Title,Uploader,Views,Likes,Comments,Upload Date,Duration (Minutes),URL,Engagement,Days Since Upload,Views Per Day,Main Category,Performance Class,Performance
blockchain technology explained 2 hour course,coding tech,4164542,47084,5600,2018-02-07,114.88,https://www.youtube.com/watch?v=qOVAbKKSH10,0.0126506107994588,2629,1584.0783567896538,Blockchain Technology,High,Medium
എനതണ ബലകകചയൻ ടകനളജ blockchain explained in malayalamwhat is blockchain part 1,binoys wall street,41549,1509,96,2023-01-06,15.58,https://www.youtube.com/watch?v=8llyUyGxrT4,0.038629088546054,835,49.75928143712575,Blockchain Technology,Low,Low
blockchain unlocked the future of tech,extraordinary7171,6,0,0,2025-03-04,1.82,https://www.youtube.com/watch?v=S3rWf_tqXbc,0.0,47,0.1276595744680851,Blockchain Technology,Low,Low
what is blockchain and how it works  hindi  quick support,quick support,874466,25748,1200,2021-04-28,6.7,https://www.youtube.com/watch?v=RaQKTgGyyyo,0.0308165211683473,1453,601.8348245010324,Blockchain Technology,Medium,Low
algorithms and data structures tutorial  full course for beginners,freecodecamporg,5042766,135889,1900,2021-03-18,322.13,https://www.youtube.com/watch?v=8hly31xKli0,0.0273240915798988,1494,3375.3453815261046,Data Structures and Algorithms,High,Medium
fastest way to learn data structures and algorithms,sahil  sarra,368892,14903,287,2024-08-04,8.7,https://www.youtube.com/watch?v=tNrNLoCqzco,0.0411773635644036,259,1424.2934362934363,Data Structures and Algorithms,High,Medium
learn data structures and algorithms for free,bro code,2024715,86743,1700,2021-11-11,240.23,https://www.youtube.com/watch?v=CBYHwZcbD-s,0.0436817033508419,1256,1612.0342356687895,Data Structures and Algorithms,High,Medium
how i mastered data structures and algorithms,ashish pratap singh,362356,17629,258,2024-07-07,10.73,https://www.youtube.com/watch?v=F-ao3Q6I2Fc,0.0493630573248407,287,1262.5644599303137,Data Structures and Algorithms,High,Medium
all in one data structures  algorithms in javascript complete course 2024 by huxn,huxn webdev,140094,5704,302,2024-07-13,339.55,https://www.youtube.com/watch?v=wBtPGnVnA9g,0.0428712150413293,281,498.5551601423488,JavaScript Development,Medium,Low
data structures and algorithms for beginners,programming with mosh,1910483,39984,730,2019-12-10,78.7,https://www.youtube.com/watch?v=BBpAmxU_NQo,0.0213108412898727,1958,975.7318692543412,Data Structures and Algorithms,Medium,Low
data structures and algorithms in 15 minutes,tren black,1174105,64633,1300,2020-12-10,16.32,https://www.youtube.com/watch?v=oz9cEqFynHU,0.0561559656078459,1592,737.5031407035176,Data Structures and Algorithms,Medium,Low
types of linked list explained   singly doubly  circular linked list  dsa for beginners,prep insta,407,11,3,2025-03-03,10.53,https://www.youtube.com/watch?v=SWMirFYFl9o,0.0343980343980344,48,8.479166666666666,Other,Low,Low
what are data structures,telusko,125046,2188,62,2023-07-26,7.1,https://www.youtube.com/watch?v=iZmDcfTtcNg,0.0179933784367352,634,197.2334384858044,Data Structures and Algorithms,Medium,Low
complete cn computer networks in one shot  semester exam  hindi,knowledgegate by sanchit sir,1415429,21347,2500,2023-09-30,378.42,https://www.youtube.com/watch?v=q3Z3Qa1UNBA,0.0168478955850134,568,2491.9524647887324,Computer Networks,High,Medium
computer networking full course  osi model deep dive with real life examples,kunal kushwaha,2022758,44990,2100,2022-01-17,246.93,https://www.youtube.com/watch?v=IPvYjXCsTg8,0.0232800957900055,1189,1701.2262405382671,Other,High,Medium
computer networks  cn in one shot  complete gate course  hindi withsanchitsir,knowledgegate by sanchit sir,74645,1301,420,2024-12-31,714.73,https://www.youtube.com/watch?v=APVCgkqWcQ4,0.0230557974412217,110,678.5909090909091,Computer Networks,Medium,Low
complete cn computer networks in one shot 10 hours  in hindi,5 minutes engineering,265574,5032,284,2024-04-12,631.22,https://www.youtube.com/watch?v=1V9mhVgVH3A,0.020017019738378,373,711.994638069705,Computer Networks,Medium,Low
computer networks in 1 video for placement  interview questions  core computer science resources,vivek gupta,92882,2506,102,2024-06-03,119.88,https://www.youtube.com/watch?v=qUBHLZEtS0M,0.0280786374109084,321,289.3520249221184,Computer Networks,Medium,Low
computer networking tutorial  bits and bytes of the networking 12 hours,bogdan stashchuk,171429,5177,88,2021-01-21,696.3,https://www.youtube.com/watch?v=PhjHXeMNpp8,0.0307124232189419,1550,110.59935483870969,Other,Medium,Low
what is computer network full explanation  pan lan man and wan network,learn coding,4307831,106126,3600,2021-01-04,10.73,https://www.youtube.com/watch?v=Hizdc4XVJ1E,0.0254712870583827,1567,2749.0944479897894,Other,High,Medium
full networking one shot class 12 ipcs  bas ye karlo ho jaega  class12 computerscience,tech queen,107973,2778,287,2023-09-22,145.57,https://www.youtube.com/watch?v=JyObIi7Tvg8,0.0283867263112074,576,187.453125,Other,Medium,Low
how to configure etherchannel link aggregation control protocol lacp using gns3,gurutech networking training,8,3,0,2025-03-05,7.37,https://www.youtube.com/watch?v=FKjNJ4rJcpQ,0.375,46,0.1739130434782608,Other,Low,Low
classification of computer networks,neso academy,626010,9653,128,2019-11-08,8.87,https://www.youtube.com/watch?v=9BIN99rHOCQ,0.0156243510487052,1990,314.5778894472362,Computer Networks,Medium,Low
iot  internet of things  what is iot   how iot works  iot explained in 6 minutes  simplilearn,simplilearn,1405011,33904,923,2020-08-24,5.87,https://www.youtube.com/watch?v=6mBO2vqLv38,0.0247877062884205,1700,826.4770588235294,Internet of Things (IoT),Medium,Low
internet of things iot  what is iot  how it works  iot explained  edureka,edureka,2622582,28494,158,2018-07-31,3.35,https://www.youtube.com/watch?v=LlhmzVL5bm8,0.0109251112071996,2455,1068.2615071283096,Internet of Things (IoT),High,Medium
learn internet of things iot in 4 hours  semester exams  one shot series  in hindi,5 minutes engineering,46430,1315,105,2024-10-18,252.8,https://www.youtube.com/watch?v=6ptZr9VRxPs,0.0305836743484815,184,252.33695652173915,Internet of Things (IoT),Medium,Low
what is iot internet of things  hindi  quick support,quick support,34152,1481,53,2025-02-08,9.9,https://www.youtube.com/watch?v=peNkYXtjtKs,0.0449168423518388,71,481.01408450704224,Internet of Things (IoT),Medium,Low
internet of things iot in 10 minutes  what is iot and how it works  great learning,great learning,375342,5676,106,2020-07-17,8.82,https://www.youtube.com/watch?v=Fj02iTrWUx0,0.0154046176553649,1738,215.9620253164557,Internet of Things (IoT),Medium,Low
iot what is internet of things  iot  iot,geospatial world,154953,2300,47,2018-04-17,3.1,https://www.youtube.com/watch?v=ZTM9GA-4nBA,0.0151465283021303,2560,60.528515625,Internet of Things (IoT),Low,Low
internet of things iot explained in hindi,5 minutes engineering,966073,25823,800,2020-05-12,9.38,https://www.youtube.com/watch?v=APH6Nrar27w,0.0275579588706029,1804,535.5171840354767,Internet of Things (IoT),Medium,Low
iot internet of things iot benefits emerging technologies in global business environment aktu,dwivedi guidance,104398,0,43,2022-04-28,7.48,https://www.youtube.com/watch?v=IF3U9u7o5UA,0.0004118852851587,1088,95.95404411764706,Internet of Things (IoT),Low,Low
air quality monitoring with esp32 using blynk iot cloud  email alert system,upload ideas with itamar,438,15,4,2025-03-04,12.12,https://www.youtube.com/watch?v=SHg8ieSYV8o,0.0433789954337899,47,9.319148936170214,Internet of Things (IoT),Low,Low
introduction to internet of things  iot,perfect computer engineer,75429,1855,33,2022-04-06,7.83,https://www.youtube.com/watch?v=ahZYZPFoHq4,0.0250301608134802,1110,67.95405405405405,Internet of Things (IoT),Low,Low
what is edge computing,techtalk,356067,4838,109,2020-05-01,3.32,https://www.youtube.com/watch?v=3hScMLH7B4o,0.0138934526367228,1815,196.1801652892562,Edge Computing,Medium,Low
what is edge computing,ibm technology,255291,4374,96,2019-10-01,10.65,https://www.youtube.com/watch?v=cEOUeItHDdo,0.0175094304147032,2028,125.88313609467455,Edge Computing,Medium,Low
what is edge computing why it is in demand will edge computing replace cloud computing 2021,it k funde,91349,3503,94,2021-09-12,11.18,https://www.youtube.com/watch?v=5aepM3ek6J0,0.0393764573230139,1316,69.41413373860182,Cloud Computing,Low,Low
what is edge computing,realpars,6059,180,12,2024-11-05,8.78,https://www.youtube.com/watch?v=qn6GDlMgoPA,0.0316883974253177,166,36.5,Edge Computing,Low,Low
is edge computing really faster,fireship,601555,25786,1200,2022-07-11,8.23,https://www.youtube.com/watch?v=yOP5-3_WFus,0.0448604034543807,1014,593.2495069033531,Edge Computing,Medium,Low
edge computing  fog computing  cloud computing,perfect computer engineer,86616,2198,40,2022-05-08,7.65,https://www.youtube.com/watch?v=iE1GxmD2csw,0.0258381823219728,1078,80.34879406307978,Cloud Computing,Low,Low
what is edge computing,accenture,9032,130,1,2022-10-18,1.55,https://www.youtube.com/watch?v=WMvb9LLXzUs,0.0145039858281665,915,9.87103825136612,Edge Computing,Low,Low
edge ai blueprints smarter fish counting with ai agents at the edge,edge ai foundation,66,7,0,2025-03-05,59.25,https://www.youtube.com/watch?v=Nh2xHJwKMD4,0.106060606060606,46,1.434782608695652,Other,Low,Low
explaining edge computing,explainingcomputers,151744,7632,592,2019-10-20,10.42,https://www.youtube.com/watch?v=0idvaOCnF9E,0.0541965415436524,2009,75.53210552513688,Edge Computing,Low,Low
what is edge computing,edge impulse,7509,166,3,2024-05-01,10.25,https://www.youtube.com/watch?v=WZQ6kCvOEaE,0.0225063257424424,354,21.21186440677966,Edge Computing,Low,Low
microsofts topological qubits probably dont exist researchers warn,sabine hossenfelder,217128,11389,1300,2025-03-04,8.42,https://www.youtube.com/watch?v=bJTsFZtD7xE,0.058440182749346,47,4619.744680851064,Other,High,Medium
quantum computers explained how quantum computing works,science abc,285838,3714,286,2024-09-23,5.68,https://www.youtube.com/watch?v=B3U1NDUiwSA,0.0139939406237099,209,1367.645933014354,Quantum Computing,High,Medium
quantum computing course  math and theory for beginners,freecodecamporg,546210,14451,371,2024-05-15,96.05,https://www.youtube.com/watch?v=tsbCSkvHhMo,0.0271360831914465,340,1606.5,Quantum Computing,High,Medium
a beginners guide to quantum computing  shohini ghose,ted,2425128,54714,2900,2019-02-01,10.08,https://www.youtube.com/watch?v=QuR969uMICM,0.0237570965326366,2270,1068.338325991189,Quantum Computing,High,Medium
what is quantum computing,ibm technology,209289,4803,197,2022-05-27,7.02,https://www.youtube.com/watch?v=lt4OsgmUTGI,0.0238904099116532,1059,197.628895184136,Quantum Computing,Medium,Low
how quantum computers break the internet starting now,veritasium,10217402,328665,10000,2023-03-20,24.47,https://www.youtube.com/watch?v=-UrdExQW0cs,0.033145901472801,762,13408.66404199475,Other,High,High
how does a quantum computer work,veritasium,5213159,102918,6900,2013-06-17,6.78,https://www.youtube.com/watch?v=g_IaVepNDT4,0.0210655381890327,4325,1205.354682080925,Other,High,Medium
michio kaku quantum computing is the next revolution,big think,2934697,67248,2800,2023-08-18,11.28,https://www.youtube.com/watch?v=qQviI1d_hFA,0.0238689036721678,611,4803.104746317512,Quantum Computing,High,Medium
lec80 cryptography in computer network in hindi  cryptography in information security,gate smashers,1015325,20677,468,2018-11-05,7.65,https://www.youtube.com/watch?v=trHox1bN5es,0.020825843941595,2358,430.5873621713316,Cryptography,Medium,Low
7 cryptography concepts every developer should know,fireship,1458194,58590,1000,2021-11-01,11.9,https://www.youtube.com/watch?v=NuyzuNBFWxQ,0.0408656187036841,1266,1151.8120063191154,Cryptography,High,Medium
cryptography full course  cryptography and network security  cryptography  simplilearn,simplilearn,223548,3660,53,2021-08-17,135.0,https://www.youtube.com/watch?v=C7vmouDOJYM,0.0166094082702596,1342,166.57824143070044,Cryptography,Medium,Low
lec83 asymmetric key cryptography with example  network security,gate smashers,475888,14330,344,2018-11-08,8.38,https://www.youtube.com/watch?v=xw19eT5thIE,0.0308349863833507,2355,202.0755838641189,Cryptography,Medium,Low
encryption  symmetric encryption vs asymmetric encryption  cryptography  practical tls,practical networking,155176,4290,162,2021-10-11,13.95,https://www.youtube.com/watch?v=o_g-M7UBqI8,0.0286900036088054,1287,120.57187257187258,Cryptography,Medium,Low
what is cryptography  cryptography explained  cryptography basics  intellipaat,intellipaat,51388,682,14,2022-01-14,2.3,https://www.youtube.com/watch?v=GQvu49c0ZZc,0.0135440180586907,1192,43.11073825503356,Cryptography,Low,Low
cryptography,neso academy,412987,6718,90,2021-04-17,13.55,https://www.youtube.com/watch?v=6_Cxj5WKpIw,0.0164847803926031,1464,282.09494535519127,Cryptography,Medium,Low
two ai agents autonomously encrypt audio chat  endtoend encryption via sound,azar channel,100,0,0,2025-03-03,1.88,https://www.youtube.com/watch?v=7sh-3pLxp9A,0.0,48,2.083333333333333,Other,Low,Low
the science of codes an intro to cryptography,scishow,1166505,31094,1400,2015-08-06,8.33,https://www.youtube.com/watch?v=-yFZGF8FHSg,0.0278558600263179,3545,329.05641748942173,Cryptography,Medium,Low
basics of computer architecture,neso academy,456345,5627,83,2021-04-20,5.97,https://www.youtube.com/watch?v=GRInNLx3Tug,0.012512463158356,1461,312.3511293634497,Computer Architecture,Medium,Low
complete coa computer organization  architecture in one shot  semester exam  hindi,knowledgegate by sanchit sir,1204851,17986,1900,2023-10-24,354.68,https://www.youtube.com/watch?v=DsK35f8wyUw,0.0165049454247869,544,2214.799632352941,Other,High,Medium
4 assembly language  computer architecture,mit opencourseware,749036,13767,307,2019-09-23,77.57,https://www.youtube.com/watch?v=L1ung0wil9Y,0.018789484083542,2036,367.8958742632613,Computer Architecture,Medium,Low
how does computer hardware work    3d animated teardown,branch education,3034080,233865,7100,2023-03-22,17.2,https://www.youtube.com/watch?v=d86ws7mQYIg,0.0794194615830828,760,3992.2105263157896,Other,High,Medium
computer architecture explained with minecraft,codeolences,1499445,73980,1100,2024-06-19,6.77,https://www.youtube.com/watch?v=dV_lf1kyV9M,0.0500718599215042,305,4916.213114754099,Computer Architecture,High,Medium
classifications of computer architecture,neso academy,311252,4166,57,2021-04-23,6.48,https://www.youtube.com/watch?v=6_PHIL4LZEU,0.013567784303394,1458,213.4787379972565,Computer Architecture,Medium,Low
intro to computer architecture,karbytes cs,758246,4992,141,2011-01-04,4.13,https://www.youtube.com/watch?v=HEjPop-aK_w,0.0067695708252994,5220,145.25785440613026,Computer Architecture,Medium,Low
digital design and computer architecture  lecture 1 introduction and basics spring 2023,onur mutlu lectures,73452,1185,56,2023-02-24,106.12,https://www.youtube.com/watch?v=VcKjvwD930o,0.016895387463922,786,93.45038167938932,Computer Architecture,Low,Low
ps genomics  lecture 1 course introduction spring 2025,onur mutlu lectures,185,14,1,2025-03-04,35.77,https://www.youtube.com/watch?v=GpjDmVIwSqw,0.081081081081081,47,3.9361702127659575,Other,Low,Low
l12 von neumanns architecture  stored memory concept in computer architecture,gate smashers,1483690,25141,507,2019-07-24,9.67,https://www.youtube.com/watch?v=j8NnE1YeSN0,0.0172866299563925,2097,707.5298044825942,Computer Architecture,Medium,Low
complete operating system in one shot  semester exam  hindi,knowledgegate by sanchit sir,1811511,27829,3600,2023-09-08,377.83,https://www.youtube.com/watch?v=xw_OuOhjauw,0.0173496048326507,590,3070.357627118644,Other,High,Medium
complete operating systems in 1 shot with notes  for placement interviews,codehelp  by babbar,1151244,22368,1800,2023-05-30,933.12,https://www.youtube.com/watch?v=3obEP8eLsCw,0.0209929432856979,691,1666.05499276411,Operating Systems,High,Medium
operating systems course for beginners,freecodecamporg,471481,15943,676,2024-08-06,1491.93,https://www.youtube.com/watch?v=yK1uBHPdp30,0.0352485041815046,257,1834.556420233463,Operating Systems,High,Medium
operating system in one shot by anuj bhaiya,coding shuttle by anuj bhaiya,774591,28292,650,2023-06-03,71.3,https://www.youtube.com/watch?v=8XBtAjKwCm4,0.0373642348026248,687,1127.4978165938865,Other,High,Medium
introduction to operating system and its functions  operating system  lecture 1,jennys lectures cs it,1573054,24196,880,2019-03-16,23.93,https://www.youtube.com/watch?v=RozoeWzT7IM,0.0159409657901127,2227,706.3556353839246,Other,Medium,Low
types of operating systems,sudhakar atchala,108716,1901,53,2021-09-21,14.27,https://www.youtube.com/watch?v=GWsxSvdd09o,0.0179734353728981,1307,83.17980107115532,Operating Systems,Low,Low
l11 introduction to operating system and its functions with english subtitles,gate smashers,4029380,97618,2600,2018-07-26,18.98,https://www.youtube.com/watch?v=WJ-UaAaumNA,0.0248718165077505,2460,1637.959349593496,Other,High,Medium
complete os operating system in one shot 7 hours  in hindi,5 minutes engineering,283807,4984,241,2024-02-16,421.13,https://www.youtube.com/watch?v=A4G0hOI6XyQ,0.0184103986159608,429,661.5547785547785,Other,Medium,Low
day 04  operating systems  ii sem  bca  process  l4,vidhyaashram,77,4,0,2025-03-04,16.62,https://www.youtube.com/watch?v=2y8hgPcgm88,0.0519480519480519,47,1.6382978723404256,Operating Systems,Low,Low
what is an operating system goals  functions of operating system  concept simplified by animation,making it simple,254582,4390,157,2020-06-06,5.47,https://www.youtube.com/watch?v=ACsLvXuaKxw,0.0178606500066776,1779,143.10399100618324,Other,Medium,Low
lec2 introduction to dbms database management system with real life examples  what is dbms,gate smashers,3216219,60920,1100,2018-07-10,11.98,https://www.youtube.com/watch?v=3EJlovevfcA,0.0192835127209931,2476,1298.957592891761,Database Management Systems,High,Medium
introduction to database management systems,neso academy,1519986,19664,278,2021-02-24,11.03,https://www.youtube.com/watch?v=6Iu45VZGQDk,0.0131198576828997,1516,1002.6292875989446,Database Management Systems,High,Medium
what is database  database management system dbms  intro to dbms,tech might,107827,0,24,2022-10-30,3.9,https://www.youtube.com/watch?v=X7v0O8yiUuY,0.0002225787604217,903,119.40974529346624,Database Management Systems,Medium,Low
complete dbms data base management system in one shot  semester exam  hindi,knowledgegate by sanchit sir,1881189,28815,3800,2023-09-15,333.5,https://www.youtube.com/watch?v=YRnjGeQbsHQ,0.0173374392471995,583,3226.739279588336,Database Management Systems,High,Medium
database management system dbms component of database system concept advantages information,dwivedi guidance,416766,7976,254,2022-06-09,10.55,https://www.youtube.com/watch?v=LYb9EZ1navY,0.0197472922455286,1046,398.4378585086042,Database Management Systems,Medium,Low
sql  complete course in 3 hours  sql one shot using mysql,apna college,10919309,171909,6100,2023-08-18,196.23,https://www.youtube.com/watch?v=hlGoQC332VM,0.0163022220545274,611,17871.209492635026,Other,High,High
what is database with full information  hindi  quick support,quick support,1328844,48342,1400,2019-08-26,10.5,https://www.youtube.com/watch?v=er3KZYgovhY,0.0374325353465117,2064,643.8197674418604,Database Management Systems,Medium,Low
database schema instances and schema diagrams amharic,ay education,148,4,0,2025-03-02,13.47,https://www.youtube.com/watch?v=w28su15U5yI,0.027027027027027,49,3.020408163265306,Database Management Systems,Low,Low
introduction to dbms  database management system  what is dbms  dbms explanation  simplilearn,simplilearn,129940,1951,41,2021-03-12,17.08,https://www.youtube.com/watch?v=mqprM5YUdpk,0.0153301523780206,1500,86.62666666666667,Database Management Systems,Low,Low
the complete web development roadmap,programming with mosh,402690,13884,460,2024-07-25,15.23,https://www.youtube.com/watch?v=GxmfcnU3feo,0.0356204524572251,269,1496.988847583643,Web Development,High,Medium
web development complete roadmap for 2025  from basics to advanced,apna college,916215,37620,1600,2024-11-17,21.98,https://www.youtube.com/watch?v=4WjtQjPQGIs,0.0428065464983655,154,5949.448051948052,Web Development,High,High
web developer roadmap 2025  everything is changing,codewithharry,934717,38734,1800,2025-01-21,21.8,https://www.youtube.com/watch?v=X8BYu3dMKf0,0.0433649971060759,89,10502.438202247193,Other,High,High
web development complete roadmap for beginners,neeraj walia,426565,17113,505,2024-05-16,5.85,https://www.youtube.com/watch?v=voXYG17rhQA,0.0413020289990974,339,1258.3038348082596,Web Development,High,Medium
fastest way to become a web developer in 2025,sahil  sarra,810783,36633,869,2024-01-20,9.78,https://www.youtube.com/watch?v=NWnBxQjssvQ,0.0462540531806907,456,1778.032894736842,Other,High,Medium
html  css full course  beginners to pro 2024  3 mini projects included  web development course,college wallah,641531,13814,563,2024-03-28,329.38,https://www.youtube.com/watch?v=HBqWsrqK89U,0.0224104524956705,388,1653.430412371134,Web Development,High,Medium
full stack web development for beginners full course on html css javascript nodejs mongodb,freecodecamporg,2405860,57319,1100,2022-11-01,449.18,https://www.youtube.com/watch?v=nu_pCVPKzTk,0.0242819615438969,901,2670.2108768035514,JavaScript Development,High,Medium
web development premium notes  all about  coding webmaster,coding webmaster,220,2,0,2025-03-03,0.33,https://www.youtube.com/watch?v=elNipzNX-kM,0.009090909090909,48,4.583333333333333,Web Development,Low,Low
frontend web development is changing quickly,fireship,1518650,64510,1800,2024-09-05,3.72,https://www.youtube.com/watch?v=TBIjgBVFjVI,0.0436637803312152,227,6690.0881057268725,Web Development,High,High
what is web development  complete roadmap from basics to advanced  2023,apna college,2290660,90272,3000,2023-10-01,14.75,https://www.youtube.com/watch?v=z0n1aQ3IxWI,0.0407183955715819,567,4039.964726631393,Web Development,High,Medium
python api development  comprehensive course for beginners,freecodecamporg,2382371,55836,2300,2021-11-01,1140.45,https://www.youtube.com/watch?v=0sOvCWFmrtA,0.0244025804545135,1266,1881.809636650869,Python Programming,High,Medium
what is an api  simply explained,apna college,2377833,81595,3400,2021-05-25,5.33,https://www.youtube.com/watch?v=XGa4onZP66Q,0.03574473060135,1426,1667.484572230014,Other,High,Medium
apis explained in 4 minutes,exponent,1368388,38573,303,2023-05-22,3.95,https://www.youtube.com/watch?v=bxuYDT-BWaI,0.0284100708278646,699,1957.636623748212,Other,High,Medium
apis for beginners  how to use an api full course  tutorial,freecodecamporg,3229017,44682,898,2023-02-06,187.1,https://www.youtube.com/watch?v=WXsD0ZgxjRw,0.0141157510164858,804,4016.190298507463,Other,High,Medium
what is rest api examples and how to use it crash course system design 3,bytebytego,984279,28234,333,2022-08-24,5.35,https://www.youtube.com/watch?v=-mN3VyJuCjM,0.029023274904778,970,1014.7206185567012,Other,High,Medium
difference between rest api vs web api vs soap api explained,learn with whiteboard,316302,7536,116,2023-05-12,7.4,https://www.youtube.com/watch?v=2mqN7ZhDsUA,0.0241920696043654,709,446.1241184767278,Other,Medium,Low
api vs sdk whats the difference,ibm technology,1517493,44200,713,2020-10-16,9.35,https://www.youtube.com/watch?v=kG-fLp9BTRo,0.0295968416328773,1647,921.367941712204,Other,Medium,Low
what is an api and how do you design it,gaurav sen,764969,16272,417,2019-03-17,15.43,https://www.youtube.com/watch?v=_YlYuNMTCc8,0.0218165703446806,2226,343.651841868823,Other,Medium,Low
what are microservices really all about and when not to use it,bytebytego,755539,20638,296,2022-10-11,4.75,https://www.youtube.com/watch?v=lTAcCNbJ7KE,0.0277073718232943,922,819.4566160520608,Microservices Architecture,Medium,Low
what are microservices when  why is it used  monolithic vs microservices architecture,apna college,434967,12617,451,2024-04-21,9.23,https://www.youtube.com/watch?v=7IFJb-uLEaI,0.0300436584844367,364,1194.9642857142858,Microservices Architecture,High,Medium
microservices explained  the what why and how,techworld with nana,932765,29551,577,2022-08-16,18.5,https://www.youtube.com/watch?v=rv4LlmLmVWk,0.032299668190809,978,953.7474437627812,Microservices Architecture,Medium,Low
monolithic vs microservice architecture which to use and when,alex hyett,112467,3557,111,2023-03-17,10.7,https://www.youtube.com/watch?v=NdeTGlZ__Do,0.0326140112210692,765,147.01568627450982,Other,Medium,Low
microservices architecture online training,questpond,21722,439,28,2023-10-07,67.33,https://www.youtube.com/watch?v=Tu8_bMNRlM4,0.0214989411656385,561,38.72014260249554,Microservices Architecture,Low,Low
microservice architecture and system design with python  kubernetes  full course,freecodecamporg,492383,12232,363,2022-11-08,304.18,https://www.youtube.com/watch?v=hmkF77F9TLw,0.0255796808581937,894,550.7639821029082,Python Programming,Medium,Low
microservices design patterns  microservices architecture patterns  edureka,edureka,255219,3783,47,2019-09-27,31.77,https://www.youtube.com/watch?v=xuH81XGWeGQ,0.0150067197191431,2032,125.59990157480316,Microservices Architecture,Medium,Low
api gateway and microservices architecture  how api gateway act as a single entry point,concept  coding  by shrayansh,69941,1709,97,2024-09-29,23.28,https://www.youtube.com/watch?v=dkgxvnk8cWw,0.0258217640582776,203,344.53694581280786,Microservices Architecture,Medium,Low
enterprise ai agents maximizing business value with enterprise ai agents and distributed systems,go cloud architects,432,35,3,2025-03-03,16.48,https://www.youtube.com/watch?v=CikoXC_FA28,0.0879629629629629,48,9.0,Other,Low,Low
what is a microservice architecture and what are its advantages,gaurav sen,735653,16941,442,2018-05-20,8.32,https://www.youtube.com/watch?v=qYhRvH9tJKw,0.0236293469883219,2527,291.1171349426197,Other,Medium,Low
