Title,Uploader,Views,Likes,Comments,Upload Date,Duration (Minutes),URL,Engagement,Days Since Upload,Views Per Day,Main Category,Performance Class,Performance
types of testing in software engineering  levels of testing,gate smashers,1094876,25586,496,2020-12-31,8.43,https://www.youtube.com/watch?v=T0TynxN77oY,0.0238218757192595,1571,696.9293443666454,Software Engineering,Medium,Low
software testing full course in 10 hours  software testing tutorial  edureka,edureka,1810968,28927,537,2021-03-11,618.5,https://www.youtube.com/watch?v=sO8eGL6SFsA,0.0162697518675095,1501,1206.5076615589608,Software Testing,High,Medium
software testing tutorial for beginners  manual  automation testing  selenium training  edureka,edureka,1474988,19306,151,2019-02-11,60.85,https://www.youtube.com/watch?v=T3q6QcCQZQg,0.013191293759678,2260,652.6495575221239,Software Testing,Medium,Low
what is software testing,telusko,308867,6005,195,2019-07-17,6.13,https://www.youtube.com/watch?v=cDQ34z0oqnQ,0.0200733649111106,2104,146.79990494296578,Software Testing,Medium,Low
the harsh truth about software testing jobs in 2025  sdet qa automation  complete roadmap,technical suneja,66984,3839,274,2025-01-25,60.25,https://www.youtube.com/watch?v=S23SvV3XGU4,0.0614027230383375,85,788.0470588235294,Software Testing,Medium,Low
software testing explained in 100 seconds,fireship,376245,20031,315,2021-05-24,2.27,https://www.youtube.com/watch?v=u6QfIXgjwGQ,0.0540764661324403,1427,263.6615276804485,Software Testing,Medium,Low
test plan in software testing  software testing  softwaretestingbymkt,softwaretestingbymkt,293056,8330,328,2019-10-21,24.97,https://www.youtube.com/watch?v=NiDe8lj-wGs,0.0295438414500982,2008,145.9442231075697,Software Testing,Medium,Low
lecture 2 what is software testing  job ready software testing course,thetestingacademy hindi,69167,1556,137,2022-12-31,11.62,https://www.youtube.com/watch?v=28hHc-K38ao,0.024476990472335,841,82.243757431629,Software Testing,Low,Low
ai solutions for enterprise testing challenges,automation testing with joe colantonio,1326,29,1,2025-03-02,32.83,https://www.youtube.com/watch?v=m8PWmO-4HAY,0.0226244343891402,49,27.06122448979592,Other,Low,Low
5 types of testing software every developer needs to know,alex hyett,108749,3954,66,2023-03-03,6.38,https://www.youtube.com/watch?v=YaXJeUkBe4Y,0.0369658571573071,779,139.6007702182285,Other,Medium,Low
what is devops devops explained  simplest explanation in hindi,apna college,1027338,32650,1100,2023-04-06,6.6,https://www.youtube.com/watch?v=h7LDnVsNRVI,0.0328518948972976,745,1378.9771812080537,DevOps,High,Medium
devops tutorial for beginners  learn devops in 7 hours  full course  devops training  edureka,edureka,3509099,45635,315,2019-06-30,407.22,https://www.youtube.com/watch?v=hQcFE0RD0cQ,0.0130945293934425,2121,1654.4549740688356,DevOps,High,Medium
devops in 5 minutes  what is devops devops explained  devops tutorial for beginners simplilearn,simplilearn,1945163,42956,241,2021-02-16,5.02,https://www.youtube.com/watch?v=Xrgk023l4lI,0.0222073934163872,1524,1276.3536745406825,DevOps,High,Medium
azure devops step by step tutorial for beginners  devops tutorial,questpond,360446,7055,501,2023-03-12,102.12,https://www.youtube.com/watch?v=aonA7Kb7WGE,0.0209629181624986,770,468.11168831168834,DevOps,Medium,Low
what is devops really understand it  devops vs sre,techworld with nana,1006589,15728,466,2022-01-18,35.53,https://www.youtube.com/watch?v=0yWAtQ6wYNM,0.0160879961930837,1188,847.297138047138,DevOps,Medium,Low
linux for devops in one shot  complete beginners to advanced linux hindi,trainwithshubham,173759,4858,262,2024-10-21,345.98,https://www.youtube.com/watch?v=e01GGTKmtpc,0.0294660995977186,181,959.9944751381216,DevOps,Medium,Low
day1  fundamentals of devops  free devops course  45 days  devopscourse learning,abhishekveeramalla,1514541,23006,1600,2023-01-05,30.65,https://www.youtube.com/watch?v=Ou9j73aWgyE,0.0162465063672756,836,1811.651913875598,DevOps,High,Medium
jenkins in one shot  devops production cicd pipelines hindi,trainwithshubham,95243,2440,424,2024-09-28,383.38,https://www.youtube.com/watch?v=XaSdKR2fOU4,0.0300704513717543,204,466.87745098039215,DevOps,Medium,Low
devops tools  the ultimate guide 2024,kodekloud,122785,4344,405,2023-01-04,17.08,https://www.youtube.com/watch?v=4It0D0Nw00c,0.0386773628700574,837,146.69653524492233,DevOps,Medium,Low
computer graphic video song  poochudava tamil movie song  abbas  simran  sirpy  music master,music master  tamil songs  ilayaraja,3207927,30277,1100,2016-10-25,4.8,https://www.youtube.com/watch?v=jFuhiuOFg28,0.009781082923645,3099,1035.1490803484994,Other,High,Medium
computer graphics,mano worldwide,183092,2415,20,2023-01-25,4.4,https://www.youtube.com/watch?v=IRXH8V4uSak,0.0132993249295436,816,224.37745098039213,Computer Graphics,Medium,Low
dda line drawing algorithm  computer graphics,abdul bari,566420,13664,671,2018-04-12,26.8,https://www.youtube.com/watch?v=W5P8GlaEOSI,0.0253080752798276,2565,220.8265107212476,Computer Graphics,Medium,Low
how do video game graphics work,branch education,4398291,282111,9500,2023-12-21,21.0,https://www.youtube.com/watch?v=C8YtdC8mxTU,0.0663009791757753,486,9049.981481481482,Other,High,High
computer graphics tutorial  introduction  cg  lec01  bhanu priya,education 4u,666847,6129,124,2019-05-28,6.9,https://www.youtube.com/watch?v=NmMky9Pg8Yc,0.0093769635313647,2154,309.5854224698236,Computer Graphics,Medium,Low
building collision simulations an introduction to computer graphics,reducible,495867,18594,478,2021-01-19,28.08,https://www.youtube.com/watch?v=eED4bSkYCB8,0.0384619262826524,1552,319.5019329896907,Computer Graphics,Medium,Low
introduction to computer graphics explained in hindi l computer graphics course,5 minutes engineering,869548,14723,240,2021-04-19,9.07,https://www.youtube.com/watch?v=uTBKa1PSyf8,0.0172077907142561,1462,594.766073871409,Computer Graphics,Medium,Low
computer graphic song  poochudava tamil movie songs  abbas  simran  sirpy  music master,music master  tamil songs  ilayaraja,75809,755,22,2016-08-16,4.4,https://www.youtube.com/watch?v=EEoKttboeJA,0.0102494426783099,3169,23.92205743136636,Other,Low,Low
the evolution of adobe and the creative software industry,ny editz,435,0,1,2025-03-03,0.47,https://www.youtube.com/watch?v=JxdFr9Z040U,0.0022988505747126,48,9.0625,Other,Low,Low
quick understanding of homogeneous coordinates for computer graphics,miolith,82926,4544,135,2023-12-03,6.88,https://www.youtube.com/watch?v=o-xwmTODTUI,0.0564237995321129,504,164.53571428571428,Computer Graphics,Medium,Low
the ultimate roadmap for embedded systems  how to become an embedded engineer in 2025,sanchit kulkarni,77030,4060,177,2025-01-04,16.82,https://www.youtube.com/watch?v=D7L1SmjQ3fo,0.0550045436842788,106,726.6981132075472,Embedded Systems,Medium,Low
microcontrollers embedded systems and stm32,thehardwareguy,18474,659,44,2021-05-22,12.53,https://www.youtube.com/watch?v=DOyuEyo_qeg,0.0380534805672837,1429,12.927921623512946,Embedded Systems,Low,Low
top 5 embedded systems courses with certification  best courses for embedded electronicsgeek,electronics geek,92645,2796,54,2023-07-16,3.15,https://www.youtube.com/watch?v=xCwcjKGZhlA,0.0307625883749797,644,143.8586956521739,Embedded Systems,Medium,Low
all about embedded systems  must master skills  different roles  salaries,sanchit kulkarni,89647,4397,258,2024-12-01,12.58,https://www.youtube.com/watch?v=_tBFaWR7gnA,0.051925887090477,140,640.3357142857143,Embedded Systems,Medium,Low
introduction to embedded system explained in hindi l embedded and real time operating system course,5 minutes engineering,512216,10640,186,2020-03-02,4.28,https://www.youtube.com/watch?v=PDYuYGHT668,0.0211356146625642,1875,273.1818666666667,Other,Medium,Low
embedded systems tutorial for beginners  lec01   bhanu priya,education 4u,514802,6345,148,2018-09-10,9.22,https://www.youtube.com/watch?v=JO4AEkOVF2M,0.0126126161126025,2414,213.2568351284176,Embedded Systems,Medium,Low
what are embedded systems   embedded system basics course preview,thors elearning solutions,38899,579,4,2022-12-30,3.22,https://www.youtube.com/watch?v=3v0J0Em02FM,0.0149875318131571,842,46.19833729216152,Embedded Systems,Low,Low
what is embedded systems and the roadmap,embedded systems in pyjama,19094,722,46,2024-08-03,43.22,https://www.youtube.com/watch?v=KopbRShTp_Y,0.0402220592856394,260,73.43846153846154,Embedded Systems,Low,Low
microcontroller  embedded system 6th semester   pin diagram of 8051   astechnic,as technic,151,11,0,2025-03-04,34.98,https://www.youtube.com/watch?v=orEsndGEdVA,0.0728476821192053,47,3.2127659574468086,Other,Low,Low
embedded systems कय हत ह  what are embedded systems in hindi  embedded systems explained,deepak techtimes,55562,1271,19,2021-09-09,4.47,https://www.youtube.com/watch?v=9cFlTUNosY4,0.023217306792412,1319,42.124336618650496,Embedded Systems,Low,Low
parallel computing and types of architecture in hindi,last moment tuitions,440766,5257,194,2017-02-19,9.73,https://www.youtube.com/watch?v=tWRL2VJL-FA,0.0123671063557533,2982,147.80885311871228,Parallel Computing,Medium,Low
parallel computing explained in 3 minutes,hooman mardox,316389,3011,54,2014-12-19,3.62,https://www.youtube.com/watch?v=q7sgzDH1cR8,0.009687441725218,3775,83.81165562913907,Parallel Computing,Low,Low
parallel computing  cloud computing  cc  lec12  bhanu priya,education 4u,134647,1454,19,2018-08-14,8.95,https://www.youtube.com/watch?v=__e3np5hrcA,0.010939716443738,2441,55.16058992216305,Cloud Computing,Low,Low
stanford cs149 i parallel computing i 2023 i lecture 1  why parallelism why efficiency,stanford online,36649,935,40,2024-09-10,72.35,https://www.youtube.com/watch?v=V1tINV2-9p4,0.0266037272504024,222,165.0855855855856,Parallel Computing,Medium,Low
what is parallel computing need limitations scope and applications of parallel computing,comrevo,21380,279,22,2020-06-27,13.4,https://www.youtube.com/watch?v=m1b74x18kZk,0.0140785781103835,1758,12.161547212741752,Parallel Computing,Low,Low
parallel computingtypes of parallel computingadvantages and disadvantage in cloud computing unit1,aastudymart,11429,111,2,2023-01-23,7.98,https://www.youtube.com/watch?v=8jKfW3Wg5VI,0.0098871292326537,818,13.971882640586797,Cloud Computing,Low,Low
how parallel processing works  ai for kids,technovation,109783,451,0,2018-01-10,2.42,https://www.youtube.com/watch?v=1XGo8K1boH4,0.0041081041691336,2657,41.31840421528039,Other,Low,Low
nhr perflab seminar hardwaresoftware codesign with the parallel research kernels,nhrfau,66,5,0,2025-03-03,59.2,https://www.youtube.com/watch?v=HTbjM5GDIRM,0.0757575757575757,48,1.375,Other,Low,Low
computer vision in healthcare and medicine,roboflow,2469,54,1,2021-03-05,13.95,https://www.youtube.com/watch?v=LYDWsMtB_J0,0.0222762251923855,1507,1.6383543463835435,Computer Vision,Low,Low
computer vision in healthcare  quantiphis computer vision capability,quantiphi,3148,26,0,2020-12-18,0.93,https://www.youtube.com/watch?v=zKZusWrX-1Y,0.008259212198221,1584,1.9873737373737368,Computer Vision,Low,Low
computer vision for healthcare ai  cell counting models  chooch readynow image recognition models,chooch,3755,28,0,2021-07-30,0.75,https://www.youtube.com/watch?v=nezqrfAP-g8,0.0074567243675099,1360,2.761029411764706,Computer Vision,Low,Low
what is computer vision in healthcare education,sim_aware,305,4,1,2023-12-11,2.98,https://www.youtube.com/watch?v=zEEK-Cnk9tA,0.0163934426229508,496,0.6149193548387096,Computer Vision,Low,Low
computer vision in medical imaging  ajay pratap singh,genomics in india,221,7,0,2022-11-01,0.85,https://www.youtube.com/watch?v=1UEWLcArsLM,0.0316742081447963,901,0.2452830188679245,Computer Vision,Low,Low
see the unseen  medivis surgicalar technology using augmented reality,medivis admin,27064,171,3,2023-06-12,0.55,https://www.youtube.com/watch?v=bkzkelf7IpI,0.0064292048477682,678,39.91740412979351,Augmented Reality,Low,Low
hightech hospital uses artificial intelligence in patient care,nbc news,229834,1406,204,2023-02-05,2.58,https://www.youtube.com/watch?v=qetKUFDDF4A,0.0070050558228982,805,285.5080745341615,Artificial Intelligence,Medium,Low
mcner webinar feb 2025  applications of ai in healthcare and nutrition research,villanovauniversity,13,0,0,2025-03-04,60.42,https://www.youtube.com/watch?v=d4DQjPiJtk8,0.0,47,0.2765957446808511,AI in Healthcare,Low,Low
computer vision in healthcare,victor panlilio photography,85,1,0,2023-04-13,26.3,https://www.youtube.com/watch?v=pokjhKI1l88,0.0117647058823529,738,0.1151761517615176,Computer Vision,Low,Low
mindblowing uses of ai in finance,jelvix  tech in 5 minutes,140676,1978,53,2020-11-03,5.0,https://www.youtube.com/watch?v=LR1aOl7Z2wk,0.0144374306918024,1629,86.35727440147329,AI in Finance,Low,Low
putting ai to work for finance,ibm technology,22976,512,26,2024-09-19,11.08,https://www.youtube.com/watch?v=kNXOCsL9OF8,0.0234157381615598,213,107.86854460093896,Other,Medium,Low
how will ai affect the financial industry,forbes,23888,393,20,2024-05-03,21.25,https://www.youtube.com/watch?v=5Qqn4OSuK_M,0.0172890154052243,352,67.86363636363636,Other,Low,Low
how ai is powering the future of financial services  jpmorgan chase  co,jpmorgan,63560,0,0,2022-09-07,19.68,https://www.youtube.com/watch?v=KjvQqgMYQeI,0.0,956,66.48535564853556,Other,Low,Low
top 10 ai tools for finance you must know in 2025,nicolas boucher,12664,371,13,2024-12-20,10.62,https://www.youtube.com/watch?v=ZS0j-BtNoms,0.0303221730890713,121,104.66115702479338,Other,Medium,Low
whats possible generative ai and finance,boston consulting group,44442,447,1,2023-07-26,2.15,https://www.youtube.com/watch?v=hPrn6Smepbk,0.0100805544304936,634,70.09779179810725,Other,Low,Low
how ai is revolutionizing finance and accounting,aipowered finance,40322,464,14,2023-07-22,8.4,https://www.youtube.com/watch?v=sicTn3mNiv8,0.0118545707058181,638,63.20062695924765,Other,Low,Low
sigtech ceo ren on how ai  finance can coexist,bloomberg live,73,4,0,2025-03-04,26.78,https://www.youtube.com/watch?v=KyOO5ShWcM4,0.0547945205479452,47,1.553191489361702,Other,Low,Low
ai in finance opportunities and challenges,the ai post,3102,76,5,2023-07-22,7.85,https://www.youtube.com/watch?v=1EBUsAEqhzI,0.0261121856866537,638,4.862068965517241,AI in Finance,Low,Low
putting an autonomous vehicle to the test in downtown london,bill gates,3904016,19785,0,2023-03-29,2.73,https://www.youtube.com/watch?v=ruKJCiAOmfg,0.0050678583284494,753,5184.6162018592295,Other,High,High
are driverless cars ready to hit the road full time,nbc news,121967,864,325,2023-08-09,4.63,https://www.youtube.com/watch?v=q01PqUubacA,0.009748538539113,620,196.72096774193548,Other,Medium,Low
selfdriving from the factory to the loading dock  tesla,tesla,480849,14997,1400,2025-01-30,0.92,https://www.youtube.com/watch?v=BO1XXRwp3mc,0.0341001021110577,80,6010.6125,Other,High,High
how self driving cars work  how autonomous vehicles work  ai  intellipaat,intellipaat,44933,752,16,2023-08-19,6.53,https://www.youtube.com/watch?v=Zl3YSPilT-w,0.0170921149266685,610,73.66065573770491,Autonomous Vehicles,Low,Low
waymos fully autonomous driving technology is here,waymo,1994344,12724,3200,2017-11-07,2.78,https://www.youtube.com/watch?v=aaOB-ErYq6Y,0.0079845803933524,2721,732.9452407203235,Other,Medium,Low
why you should want driverless cars on roads now,veritasium,3454781,173487,29000,2021-07-23,18.12,https://www.youtube.com/watch?v=yjztvddhZmI,0.058610661573049,1367,2527.2721287490854,Other,High,Medium
waymo showcases fully autonomous car amid safety concerns,cbs mornings,65255,551,287,2024-12-24,3.88,https://www.youtube.com/watch?v=ErgD-ZHVMsQ,0.0128419278216228,117,557.7350427350427,Other,Medium,Low
autonomous vehicles the future of transportation,provision tech,2208,21,0,2023-10-06,6.33,https://www.youtube.com/watch?v=4aDyIKRcsvY,0.0095108695652173,562,3.928825622775801,Autonomous Vehicles,Low,Low
how selfdriving cars work  the ai behind autonomous vehicles  ai ai machinelearning tesla,scishorts,576,10,1,2025-03-02,0.95,https://www.youtube.com/watch?v=8_rd0U_6EWo,0.0190972222222222,49,11.755102040816327,Autonomous Vehicles,Low,Low
meet iceman and wolverine  the 2 coolest robots in teslas factory,business insider,306646,1596,78,2015-10-06,1.42,https://www.youtube.com/watch?v=WYnOGAvQEgk,0.0054590635455867,3484,88.01549942594718,Other,Low,Low
rpa in 5 minutes  what is rpa  robotic process automation  rpa explained  simplilearn,simplilearn,882409,15835,864,2020-05-20,5.58,https://www.youtube.com/watch?v=9URSbTOE4YI,0.0189243310075033,1796,491.31904231625833,Other,Medium,Low
robotics and automation a great domain to start your career in 2023  by raunak gupta,gyaannirudra,4649,95,18,2023-04-22,10.92,https://www.youtube.com/watch?v=Zkd8CxsSzws,0.0243063024306302,729,6.377229080932785,Robotics and Automation,Low,Low
automated machine tending using a universal ur5e cobot,the sempre group,186030,775,41,2020-09-29,0.88,https://www.youtube.com/watch?v=35KhfiAmE4o,0.0043863892920496,1664,111.796875,Other,Medium,Low
what is robotics  robotics explained  robotics technology  what are robots,tech might,334070,0,99,2021-06-10,3.55,https://www.youtube.com/watch?v=htjRUL3neMg,0.0002963450773789,1410,236.9290780141844,Robotics and Automation,Medium,Low
worlds most advanced robotic warehouse ai automation,brightpick,412455,7004,516,2024-10-15,10.43,https://www.youtube.com/watch?v=U2AGLeJBFNg,0.0182322920076129,187,2205.6417112299464,Other,High,Medium
cool careers  episode 4 robotics and automation,hirepaths,17419,124,6,2022-02-16,5.9,https://www.youtube.com/watch?v=A6qv8SnH4M0,0.0074631149893794,1159,15.029335634167383,Robotics and Automation,Low,Low
is robotics engineering worth it  future college jobs in robotics and automation  2024,aryan jagushte,5837,118,196,2024-07-07,7.55,https://www.youtube.com/watch?v=2yLulkr2OUY,0.0537947575809491,287,20.33797909407665,Robotics and Automation,Low,Low
humanoid robots are taking over warehouse jobs  humanoidrobots warehouseautomationairobots,the trend report,573,22,3,2025-03-02,0.62,https://www.youtube.com/watch?v=ff4rwr8HvtQ,0.0436300174520069,49,11.693877551020408,Other,Low,Low
robotics engineers are in high demand  but what is the job really like,cnbc international,215041,5111,158,2024-11-25,11.0,https://www.youtube.com/watch?v=z_uGhq2ayVA,0.0245023042117549,146,1472.8835616438355,Robotics and Automation,High,Medium
natural language processing in artificial intelligence in hindi  nlp with demo and examples,gate smashers,861020,16418,525,2019-05-16,17.3,https://www.youtube.com/watch?v=bPpwZxasJo0,0.0196778239762142,2166,397.5161588180979,Artificial Intelligence,Medium,Low
natural language understanding explained,moveworks,1050,17,0,2024-02-07,1.75,https://www.youtube.com/watch?v=wm90DysmchM,0.0161904761904761,438,2.3972602739726026,Other,Low,Low
complete nlp machine learning in one shot,krish naik,257598,4818,214,2023-11-27,233.17,https://www.youtube.com/watch?v=ENLEjGozrio,0.0195343131546052,510,505.09411764705885,Machine Learning,Medium,Low
natural language processing in 5 minutes  what is nlp and how does it work  simplilearn,simplilearn,687439,11638,568,2021-03-17,5.48,https://www.youtube.com/watch?v=CMrHM8a3hqw,0.0177557572380967,1495,459.8254180602007,Natural Language Processing,Medium,Low
stanford xcs224u nlu i intro  evolution of natural language understanding pt 1 i  spring 2023,stanford online,76801,1327,30,2023-08-17,73.87,https://www.youtube.com/watch?v=K_Dh0Sxujuc,0.0176690407676983,612,125.49183006535948,Natural Language Understanding,Medium,Low
what is mistral ai ai aitrending artificialintelligence,deep ai,412,9,1,2025-03-02,0.3,https://www.youtube.com/watch?v=fEixnkCTN3s,0.0242718446601941,49,8.408163265306122,Other,Low,Low
diffrence between nlu and nlg  natural language understanding vs natural  language processing  ai,ai master,1216,25,1,2023-05-24,5.07,https://www.youtube.com/watch?v=LLQlDv-MFno,0.0213815789473684,697,1.744619799139168,Natural Language Understanding,Low,Low
what is ai ethics  ai ethics foundation  how to implement ai ethics  edureka,edureka,7633,112,4,2024-05-08,9.95,https://www.youtube.com/watch?v=COgvUFGLPCs,0.015197170182104,347,21.9971181556196,AI Ethics,Low,Low
what is ai ethics,ibm technology,128562,2157,76,2021-09-30,6.17,https://www.youtube.com/watch?v=aGwYtUzMQUk,0.0173690515082217,1298,99.0462249614792,AI Ethics,Low,Low
ai ethics  ethics defined,mccombs school of business,10805,92,4,2024-09-06,3.5,https://www.youtube.com/watch?v=6yDr7CWLJ8c,0.0088847755668671,226,47.809734513274336,AI Ethics,Low,Low
artificial intelligence and its ethics  dw documentary,dw documentary,2001606,10479,1200,2019-08-14,42.43,https://www.youtube.com/watch?v=Izd2qOgOGQI,0.0058348146438409,2076,964.164739884393,Artificial Intelligence,Medium,Low
artificial intelligence class 9 chapter 1  ethics of artificial intelligence  introduction to ai,magnet brains,110601,2491,349,2021-08-10,39.95,https://www.youtube.com/watch?v=BjdpKNRVuvY,0.0256778871800435,1349,81.9873980726464,Artificial Intelligence,Low,Low
artificial intelligence and ethics  studyiq ias,studyiq ias,92699,2764,86,2022-11-26,27.03,https://www.youtube.com/watch?v=kyIf3OwcC9c,0.0307446682272732,876,105.82077625570776,Artificial Intelligence,Medium,Low
ai is dangerous but not for the reasons you think  sasha luccioni  ted,ted,1325282,25273,2000,2023-11-06,10.32,https://www.youtube.com/watch?v=eXdVDhOGqoE,0.0205790163904738,531,2495.822975517891,Other,High,Medium
the ethics of aistuart j russell university of california berkeley professor,world knowledge forum,21958,665,41,2025-01-04,31.78,https://www.youtube.com/watch?v=KiT0T12Yyno,0.0321522907368612,106,207.1509433962264,Other,Medium,Low
ethical ai,unitarian society santa barbara,27,2,0,2025-03-03,72.93,https://www.youtube.com/watch?v=HE0-TWTwiO0,0.074074074074074,48,0.5625,Other,Low,Low
ethics of ai challenges and governance,unesco,78807,866,0,2023-02-06,6.87,https://www.youtube.com/watch?v=VqFqWIqOB1g,0.0109888715469438,804,98.01865671641792,Other,Low,Low
big data analytics  what is big data analytics  big data analytics for beginners  simplilearn,simplilearn,175040,2791,56,2019-05-08,28.48,https://www.youtube.com/watch?v=bY6ZzQmtOzk,0.0162648537477148,2174,80.5151793928243,Big Data,Low,Low
introduction to big data analytics,perfect computer engineer,272477,4338,161,2020-11-13,8.33,https://www.youtube.com/watch?v=I_ku0D4uQzQ,0.0165114853730773,1619,168.2995676343422,Big Data,Medium,Low
big data  hadoop full course  learn hadoop in 10 hours  hadoop tutorial for beginners  edureka,edureka,1480614,16817,192,2019-09-01,627.62,https://www.youtube.com/watch?v=1vbXmCrkT3Y,0.011487801682275,2058,719.4431486880467,Big Data,Medium,Low
big data analytics explained with examples in hindi,5 minutes engineering,91660,1612,28,2023-01-06,6.0,https://www.youtube.com/watch?v=iW0hPuvuKOE,0.0178922103425703,835,109.77245508982035,Big Data,Medium,Low
big data engineering full course part 1  17 hours,the data tech,312885,7373,209,2023-08-28,571.88,https://www.youtube.com/watch?v=Tyg1FVNq40g,0.0242325455039391,601,520.6073211314476,Big Data,Medium,Low
big data analytics explained  what is big data analytics  big data tutorial  simplilearn,simplilearn,19133,301,7,2022-06-29,16.47,https://www.youtube.com/watch?v=h78258SRS9Y,0.0160978414258088,1026,18.64814814814815,Big Data,Low,Low
big data analytics  how to connect azure storage with power bi  sqlschool,sql school,117,11,1,2025-03-02,35.72,https://www.youtube.com/watch?v=dSycGJPC-l4,0.1025641025641025,49,2.3877551020408165,Big Data,Low,Low
what is augmented reality ar,ibm technology,23859,453,9,2024-10-02,5.2,https://www.youtube.com/watch?v=QpbJwad6v_s,0.0193637621023513,200,119.295,Augmented Reality,Medium,Low
what is augmented reality ar in 60 seconds,bernard marr,216558,2162,66,2021-02-09,1.3,https://www.youtube.com/watch?v=XPNUmcEOYW0,0.0102882368695684,1531,141.44872632266492,Augmented Reality,Medium,Low
augmented reality ar and virtual reality vr explained,cdr sh pallikkal,220007,4651,90,2020-09-09,5.95,https://www.youtube.com/watch?v=h3rKvsFTfPA,0.0215493143399982,1684,130.64548693586698,Augmented Reality,Medium,Low
augmented reality for advertising,unitear augmented reality,49088,161,5,2019-12-05,0.4,https://www.youtube.com/watch?v=2tPljGrlccY,0.0033816818774445,1963,25.00662251655629,Augmented Reality,Low,Low
i tried real augmented reality glasses,marques brownlee,5935582,146330,7100,2024-11-01,20.48,https://www.youtube.com/watch?v=G0eKzU_fV00,0.0258491922106374,170,34915.18823529412,Augmented Reality,High,High
augmented reality zoo,go to magic,27539264,43411,792,2015-06-21,4.12,https://www.youtube.com/watch?v=Xmpe1uYTDgI,0.0016050900997208,3591,7668.967975494291,Augmented Reality,High,High
the rise of technologyaugmented realityar virtual realityvr and mixed realitymr simplilearn,simplilearn,751433,11561,170,2020-04-03,8.65,https://www.youtube.com/watch?v=XLP4YTpUpBI,0.0156115049512065,1843,407.7227346717309,Augmented Reality,Medium,Low
the future of augmented reality 2030,future business tech,76917,1217,62,2022-11-19,5.08,https://www.youtube.com/watch?v=D8V2nxeWHmI,0.0166283136367773,883,87.10872027180068,Augmented Reality,Low,Low
mario circuit looks completely different in the new mario kart shorts,rays nintendo talk,52,16,0,2025-03-04,0.7,https://www.youtube.com/watch?v=FgBw_SpRO0c,0.3076923076923077,47,1.1063829787234043,Other,Low,Low
explore earth augmented reality sample,magic edtech,89550,779,19,2017-10-10,1.55,https://www.youtube.com/watch?v=47GVkOv9RuA,0.0089112227805695,2749,32.575481993452165,Augmented Reality,Low,Low
dad wasnt ready for virtual reality,daily dose of internet,15625855,1070297,10000,2023-07-15,0.27,https://www.youtube.com/watch?v=-v9SWaYhKiQ,0.0691352249204923,645,24226.131782945737,Virtual Reality,High,High
