Title,Uploader,Views,Likes,Comments,Upload Date,Duration (Minutes),URL,Engagement,Days Since Upload,Views Per Day,Main Category,Performance Class,Performance
worlds smallest 4k headset  visorcom tech vr technology virtualreality insideout2,immersed,190060229,4079326,7200,2024-06-21,0.25,https://www.youtube.com/watch?v=-055GvEU7f0,0.0215012158067009,303,627261.4818481848,Other,High,High
google earth vr  bringing the whole wide world to virtual reality,google,4041437,26097,1800,2016-11-16,1.07,https://www.youtube.com/watch?v=SCrkZOx5Q1M,0.0069027427620423,3077,1313.4341891452714,Virtual Reality,High,Medium
virtual reality is not what you think,damilee,435404,19232,1800,2023-08-31,15.42,https://www.youtube.com/watch?v=wsFOLf1WvNs,0.0483045631183911,598,728.1003344481605,Virtual Reality,Medium,Low
how virtual reality tricks your brain,vox,976520,31223,1200,2020-12-22,6.23,https://www.youtube.com/watch?v=ybyib5pAq7Y,0.0332025969770204,1580,618.0506329113924,Virtual Reality,Medium,Low
what is virtual reality vr in 60 seconds,bernard marr,127500,1232,107,2021-03-08,1.48,https://www.youtube.com/watch?v=YLb1gnmsceA,0.0105019607843137,1504,84.77393617021276,Virtual Reality,Low,Low
the rise of technologyaugmented realityar virtual realityvr and mixed realitymr simplilearn,simplilearn,751433,11561,170,2020-04-03,8.65,https://www.youtube.com/watch?v=XLP4YTpUpBI,0.0156115049512065,1843,407.7227346717309,Augmented Reality,Medium,Low
clash of clans 360 experience a virtual reality raid,clash of clans,104214132,1300574,40000,2015-12-07,1.38,https://www.youtube.com/watch?v=wczdECcwRw0,0.0128636488571434,3422,30454.158971361776,Virtual Reality,High,High
augmented reality ar and virtual reality vr explained,cdr sh pallikkal,220007,4651,90,2020-09-09,5.95,https://www.youtube.com/watch?v=h3rKvsFTfPA,0.0215493143399982,1684,130.64548693586698,Augmented Reality,Medium,Low
what is cloud security,ibm technology,297803,4543,116,2019-09-27,10.28,https://www.youtube.com/watch?v=jI8IKpjiCSM,0.0156445704039247,2032,146.55659448818898,Cloud Security,Medium,Low
what is cloud security  cloud security fundamentals  cloud computing tutorial  simplilearn,simplilearn,7566,153,1,2024-07-16,9.98,https://www.youtube.com/watch?v=Qt9lhzFhW_c,0.0203542162305048,278,27.215827338129497,Cloud Computing,Low,Low
13 cyber security projects to get you hired updated 2025,unixguy  cyber security,14112,1179,161,2025-03-03,20.87,https://www.youtube.com/watch?v=CWtLdR2SxNY,0.0949546485260771,48,294.0,Other,Medium,Low
fastest way to learn cloud security and actually get a job 2025,unixguy  cyber security,40049,2020,348,2024-12-27,34.48,https://www.youtube.com/watch?v=r86YCwX_iU4,0.0591275687283078,114,351.3070175438597,Cloud Security,Medium,Low
cloud security tutorial for beginners  what is cloud security,tech with soleyman,25196,589,17,2024-05-09,16.08,https://www.youtube.com/watch?v=sF014G2BUXM,0.0240514367359898,346,72.82080924855491,Cloud Security,Low,Low
cloud security tutorial  cloud security fundamentals  what is cloud security  edureka,edureka,177850,1585,30,2017-04-07,26.08,https://www.youtube.com/watch?v=0lw4KU5wHsk,0.0090806859713241,2935,60.59625212947189,Cloud Security,Low,Low
cloud security interview questions and answers  scenario based cloud security interview questions,cyberplatter,14900,361,7,2024-06-24,47.17,https://www.youtube.com/watch?v=JsKqexbMJs8,0.0246979865771812,300,49.66666666666666,Cloud Security,Low,Low
cloud security risks exploring the latest threat landscape report,ibm technology,45163,1344,57,2024-10-01,11.53,https://www.youtube.com/watch?v=VK0GyUSDwQY,0.031020968491907,201,224.6915422885572,Cloud Security,Medium,Low
aws reinforce 2019 the fundamentals of aws cloud security fnd209r,amazon web services,163643,2643,72,2019-06-26,48.07,https://www.youtube.com/watch?v=-ObImxw1PmI,0.0165909938096954,2125,77.0084705882353,Cloud Security,Low,Low
availity modernizes healthcare technology through collaboration with aws  amazon web services,amazon web services,223,8,0,2025-03-03,2.75,https://www.youtube.com/watch?v=IGfITij1GVY,0.0358744394618834,48,4.645833333333333,AI in Healthcare,Low,Low
the cycle of cyber threat intelligence,sans digital forensics and incident response,121621,2037,29,2019-09-03,60.45,https://www.youtube.com/watch?v=J7e74QLVxCk,0.0169871979345672,2056,59.15418287937743,Cyber Threat Intelligence,Low,Low
how to become a cyber threat intel analyst,cyber intel with gary ruddell,12749,533,34,2024-03-07,2.52,https://www.youtube.com/watch?v=3KFHOamRl-s,0.0444740763981488,409,31.17114914425428,Cyber Threat Intelligence,Low,Low
creating a threat intelligence program from scratch part 1,prabh nair,13094,275,14,2023-08-22,30.23,https://www.youtube.com/watch?v=p7by_uWzdEg,0.0220711776386131,607,21.57166392092257,Other,Low,Low
what is cyber threat intelligence,relative security,4788,63,3,2022-09-06,12.15,https://www.youtube.com/watch?v=SNN0dAcfBAU,0.0137844611528822,957,5.003134796238244,Cyber Threat Intelligence,Low,Low
introduction to cyber threat intelligence  tryhackme,motasem hamdan  cyber security  tech,13467,234,10,2022-10-16,26.57,https://www.youtube.com/watch?v=OZ80zXwTh0g,0.0181183634068463,917,14.685932388222463,Cyber Threat Intelligence,Low,Low
what is cyber threat intelligence  कय ह सइबर खतर क खफय जनकर,masters in ethical hacking 20,11608,349,38,2021-02-03,9.57,https://www.youtube.com/watch?v=Z2ll8mg1mCY,0.0333390764989662,1537,7.552374756018217,Cyber Threat Intelligence,Low,Low
what is cyber threat intelligence and how to stand out as threat intelligence analyst,hacker valley media,17998,263,15,2023-04-04,29.3,https://www.youtube.com/watch?v=eme2jfTeoVo,0.0154461606845205,747,24.093708165997324,Cyber Threat Intelligence,Low,Low
cyber threat intelligence 101  types of threat intelligence,blue team resources,2158,40,2,2023-09-01,7.17,https://www.youtube.com/watch?v=sSQ0vtoZspo,0.0194624652455977,597,3.6147403685092128,Cyber Threat Intelligence,Low,Low
unified security intune  microsoft defender for endpoint  microsoft technical takeoff,windows it pro,648,11,0,2025-03-04,29.97,https://www.youtube.com/watch?v=FKWYvjkatho,0.0169753086419753,47,13.787234042553193,Other,Low,Low
threat intelligence made easy  soc experts,soc experts,55947,1649,102,2021-04-26,11.8,https://www.youtube.com/watch?v=gt_qBvccvqE,0.0312974779702218,1455,38.45154639175258,Other,Low,Low
but what is a neural network  deep learning chapter 1,3blue1brown,18756149,457380,7800,2017-10-05,18.68,https://www.youtube.com/watch?v=aircAruvnKk,0.0248014664417519,2754,6810.5116194626,Deep Learning,High,High
neural networks explained in 5 minutes,ibm technology,348032,7546,115,2022-05-24,4.52,https://www.youtube.com/watch?v=jmmW0F0biz0,0.022012343692534,1062,327.71374764595106,Neural Networks,Medium,Low
neural network in 5 minutes  what is a neural network  how neural networks work  simplilearn,simplilearn,1544791,30836,1300,2019-06-19,5.75,https://www.youtube.com/watch?v=bfmFfD2RIcg,0.0208028141023607,2132,724.5736397748593,Neural Networks,Medium,Low
lecture 11  introduction to neural networks  stanford cs229 machine learning autumn 2018,stanford online,192501,2381,65,2020-04-17,80.23,https://www.youtube.com/watch?v=MfIjxPh6Pys,0.0127064274990779,1829,105.24931656642974,Machine Learning,Medium,Low
the essential main ideas of neural networks,statquest with josh starmer,1064739,28742,2100,2020-08-31,18.9,https://www.youtube.com/watch?v=CqOfi41LfDw,0.0289667233002641,1693,628.9066745422327,Neural Networks,Medium,Low
introduction to neural networks with example in hindi  artificial intelligence,gate smashers,1185908,21096,682,2019-05-11,11.33,https://www.youtube.com/watch?v=EYeF2e2IKEo,0.018363987762963,2171,546.2496545370797,Artificial Intelligence,Medium,Low
the spelledout intro to neural networks and backpropagation building micrograd,andrej karpathy,2305130,50885,2000,2022-08-16,145.87,https://www.youtube.com/watch?v=VMj-3S1tku0,0.022942306941474,978,2356.9836400817994,Neural Networks,High,Medium
neural network simply explained  deep learning tutorial 4 tensorflow20 keras  python,codebasics,488624,17638,1100,2020-07-14,11.0,https://www.youtube.com/watch?v=ER2It2mIagI,0.0383485051900848,1741,280.6570936243538,Deep Learning,Medium,Low
speedrun on neural networks lets go interesting students ai neuralnetworks techtips,neurohacks,417,8,0,2025-03-02,0.23,https://www.youtube.com/watch?v=OMoMEPZOFag,0.0191846522781774,49,8.510204081632653,Neural Networks,Low,Low
explained in a minute neural networks,samuel arzt,511093,9591,167,2017-09-02,1.07,https://www.youtube.com/watch?v=rEDzUT3ymw4,0.0190924156660333,2787,183.38464298528885,Neural Networks,Medium,Low
introduction to game playing in artificial intelligence  learn game playing algorithms with example,gate smashers,644524,10230,166,2019-04-13,7.12,https://www.youtube.com/watch?v=FFzdXJ49KAI,0.0161297329502082,2199,293.0986812187358,Artificial Intelligence,Medium,Low
new ai creates whole games no coding needed,ai samson,14951,632,119,2025-03-01,29.53,https://www.youtube.com/watch?v=pM6UCfutpLg,0.0502307537957327,50,299.02,Other,Medium,Low
how ai is actually used in the video games industry  ai 101,ai and games,26921,1244,42,2024-02-28,19.12,https://www.youtube.com/watch?v=j3LW5no-5Ao,0.0477693993536644,417,64.55875299760191,Other,Low,Low
how ai is transforming gaming 2025 trends,fnmonsters,5887,196,6,2025-01-11,13.53,https://www.youtube.com/watch?v=fqZkmTqXcTY,0.0343128928146764,99,59.464646464646464,AI in Gaming,Low,Low
microsofts new game ai how is this good,two minute papers,41527,1835,164,2025-03-03,6.5,https://www.youtube.com/watch?v=dapcphnRROM,0.0481373564187155,48,865.1458333333334,Other,Medium,Low
the rise of ai gaming,ai justin,37001,14020,247,2024-07-21,10.18,https://www.youtube.com/watch?v=HkTVwxmZt1w,0.3855841734007189,273,135.53479853479854,AI in Gaming,Medium,Low
how ai is taking over gaming in 2024,simple tech studio,21566,702,28,2024-05-03,7.98,https://www.youtube.com/watch?v=mu3gjDgY400,0.0338495780395066,352,61.26704545454545,AI in Gaming,Low,Low
why is it difficult to make good ai for games  ai 101,ai and games,76134,3583,311,2024-01-24,14.98,https://www.youtube.com/watch?v=qCkqpRnk1oU,0.0511466624635511,452,168.43805309734512,Other,Medium,Low
this nextgen technology will change games forever,bluedrake42,386353,15814,2000,2024-11-11,16.72,https://www.youtube.com/watch?v=lmVdfI9JXwU,0.0461080928580857,160,2414.70625,Other,High,Medium
scientists finally reveal we are already living in simulation,getsetflyscience by gaurav thakur,1602404,71410,3100,2023-04-26,13.05,https://www.youtube.com/watch?v=rc1NkRJgPbU,0.0464988854246494,725,2210.212413793103,Other,High,Medium
we live in a simulation the evidence is everywhere all you have to do is look,the why files,15122970,488451,50000,2022-06-07,22.9,https://www.youtube.com/watch?v=4wMhXxZ1zNM,0.0356048448155355,1048,14430.314885496184,Other,High,High
inner state  computer simulation,psychedelic universe,23351,531,14,2019-08-14,6.98,https://www.youtube.com/watch?v=Ol1xB9TvYR4,0.0233394715429746,2076,11.248073217726397,Computer Simulation,Low,Low
what if were living in a computer simulation,what if,624135,17951,1900,2019-03-09,3.6,https://www.youtube.com/watch?v=v3uXy1hGVAo,0.0318056189766637,2234,279.3800358102059,Computer Simulation,Medium,Low
what is computer simulation simple explanation for nonengineers,cyprien rusu,11006,272,19,2022-01-21,9.25,https://www.youtube.com/watch?v=fXrBxZrgKe4,0.0264401235689623,1185,9.28776371308017,Computer Simulation,Low,Low
neil degrasse tyson explains the simulation hypothesis,startalk,2476112,75636,10000,2020-03-18,7.88,https://www.youtube.com/watch?v=pmcrG7ZZKUc,0.0345848653049619,1859,1331.9591178052715,Other,High,Medium
the simulation hypothesis is pseudoscience,sabine hossenfelder,476201,27318,8500,2021-02-13,10.08,https://www.youtube.com/watch?v=HCSqogSPU_Q,0.0752161377233563,1527,311.85396201702684,Other,Medium,Low
computer flowchart working model with led lights  computer project  diy  howtofunda,howtofunda,476,8,0,2025-03-03,5.4,https://www.youtube.com/watch?v=fFVneEMdSTo,0.0168067226890756,48,9.916666666666666,Other,Low,Low
ऐस पत चलग क य दनय एक simulation ह experiments that may prove that we live in a simulation,अतरकष tv,288658,12823,1100,2023-04-21,13.27,https://www.youtube.com/watch?v=Vfs3khEOKLA,0.048233549737059,730,395.4219178082192,Other,Medium,Low
how does speech recognition work learn about speech to text voice recognition and speech synthesis,acadaimy,100287,2262,203,2020-08-22,6.4,https://www.youtube.com/watch?v=6altVgTOf9s,0.024579456958529,1702,58.92303172737955,Speech Recognition,Low,Low
automatic speech recognition  an overview,microsoft research,141376,2516,97,2017-09-11,84.67,https://www.youtube.com/watch?v=q67z7PTGRi8,0.0184826278859212,2778,50.89128869690425,Speech Recognition,Low,Low
python speech recognition tutorial  full course for beginners,freecodecamporg,267874,7107,180,2022-06-08,119.67,https://www.youtube.com/watch?v=mYUyaKmvu6Y,0.027203088018994,1047,255.84909264565425,Python Programming,Medium,Low
what is speech recognition,deepgram,25551,255,5,2021-07-30,2.3,https://www.youtube.com/watch?v=uSNUmJffK4c,0.0101757269774177,1360,18.7875,Speech Recognition,Low,Low
speech recognition how to disable speech recognition in windows 10 windows speech recognition off,technical support arman,90787,1049,178,2022-01-03,1.77,https://www.youtube.com/watch?v=jcw_B8eUQ0A,0.0135151508475883,1203,75.46716541978387,Speech Recognition,Low,Low
i built a personal speech recognition system for my ai assistant,the ai hacker,284961,8263,312,2020-07-29,16.53,https://www.youtube.com/watch?v=YereI6Gn3bM,0.0300918371285895,1726,165.09907300115876,Speech Recognition,Medium,Low
how voice recognition works,iluli by mike lamb,137949,1268,83,2021-05-01,5.0,https://www.youtube.com/watch?v=2RRT1YuyBCo,0.0097934743999594,1450,95.13724137931034,Other,Low,Low
voice typing tutorial how to type by talking on windows 11 using voice typing feature,tongbos_en,69,0,0,2025-03-02,1.55,https://www.youtube.com/watch?v=TIWvVgWOHFU,0.0,49,1.4081632653061225,Other,Low,Low
mit 6s191 automatic speech recognition,alexander amini,32056,512,16,2022-05-02,41.73,https://www.youtube.com/watch?v=sR6_bZ6VkAg,0.0164711754429747,1084,29.571955719557195,Speech Recognition,Low,Low
artificial intelligence in healthcare opportunities and challenges  navid toosi saidy  tedxqut,tedx talks,194905,3145,97,2021-11-18,8.6,https://www.youtube.com/watch?v=uvqDTbusdUU,0.0166337446448269,1249,156.048839071257,Artificial Intelligence,Medium,Low
artificial intelligence in healthcare  examples of ai in healthcare  edureka,edureka,168222,2711,37,2019-06-20,29.18,https://www.youtube.com/watch?v=j6EB9HO6acE,0.01633555658594,2131,78.94040356640075,Artificial Intelligence,Low,Low
stanford med live the state of ai in healthcare and medicine,stanford medicine,38647,0,6,2024-03-25,58.63,https://www.youtube.com/watch?v=D7O3wn3TjNU,0.0001552513778559,391,98.84143222506394,AI in Healthcare,Low,Low
how ai can heal healthcare  edmund jackson  tedxnashville,tedx talks,256065,19878,146,2024-10-21,12.7,https://www.youtube.com/watch?v=7ZsyYCZB3Nw,0.0781988948118641,181,1414.7237569060774,AI in Healthcare,High,Medium
a look at how artificial intelligence is shaping the health industry,today,6110,76,6,2025-01-13,5.02,https://www.youtube.com/watch?v=-8lTI4RSTN4,0.0134206219312602,97,62.98969072164948,Artificial Intelligence,Low,Low
ai in health care  promises and concerns of artificial intelligence and health,uc davis health,90588,790,41,2023-12-28,39.23,https://www.youtube.com/watch?v=SCJnwT-h7Aw,0.0091734004503907,479,189.11899791231733,Artificial Intelligence,Medium,Low
4 ways artificial intelligence is transforming healthcare,med school insiders,322012,2993,121,2023-06-24,9.67,https://www.youtube.com/watch?v=TfkHrvct1hg,0.0096704470640845,666,483.5015015015015,Artificial Intelligence,Medium,Low
ai transforms health care  artificial intelligence the future of medicine  health care is here,stanford health care,11424,246,0,2024-09-17,38.35,https://www.youtube.com/watch?v=wD1qn2i3Wb4,0.0215336134453781,215,53.13488372093023,Artificial Intelligence,Low,Low
ai in medicine faster ailment detection promises to revolutionize health labs,ntvuganda,361,3,1,2025-03-03,2.68,https://www.youtube.com/watch?v=bDOatWeRvqA,0.0110803324099723,48,7.520833333333333,Other,Low,Low
ai in healthcare the next frontier  leonardo castorina  tedxuniversityofedinburgh,tedx talks,30672,553,13,2023-11-27,14.58,https://www.youtube.com/watch?v=3PbEgLw6lJ0,0.0184533124673969,510,60.14117647058824,AI in Healthcare,Low,Low
what is dsp why do you need it,parts express,228051,1827,85,2017-10-23,2.33,https://www.youtube.com/watch?v=a4C5vpiBm4Q,0.0083840895238345,2736,83.35197368421052,Digital Signal Processing,Low,Low
dsp1 introduction to digital signal processing  ec academy,ec academy,675275,6214,266,2020-09-22,7.03,https://www.youtube.com/watch?v=cIH5o7wYNzs,0.0095960904816556,1671,404.114302812687,Digital Signal Processing,Medium,Low
digital signal processing basics and nyquist sampling theorem,columbia gorge community college,191775,2208,26,2014-02-24,20.2,https://www.youtube.com/watch?v=WgJMjDh0nLU,0.0116490679181332,4073,47.08445863000245,Other,Low,Low
the mathematics of signal processing  the ztransform discrete signals and more,zach star,445126,10909,354,2019-10-24,29.78,https://www.youtube.com/watch?v=hewTwm5P0Gg,0.0253029479293503,2005,222.0079800498753,Other,Medium,Low
what is digital signal processing dsp advantages  relation with home theatre  ooberpad,ooberpad,17467,238,11,2020-10-21,4.82,https://www.youtube.com/watch?v=zvaYD8ojceI,0.0142554531402072,1642,10.637637028014616,Digital Signal Processing,Low,Low
what is explainable ai,ibm technology,43220,1206,28,2022-05-04,7.48,https://www.youtube.com/watch?v=jFHPEQi55Ko,0.0285515964831096,1082,39.944547134935306,Explainable AI,Low,Low
what is explainable ai,matlab,18810,388,3,2024-03-07,3.77,https://www.youtube.com/watch?v=It2Q1eK_Klc,0.0207868155236576,409,45.99022004889976,Explainable AI,Low,Low
what is explainable ai,google cloud tech,22884,431,8,2022-12-22,5.02,https://www.youtube.com/watch?v=rHChrruNBTo,0.0191837091417584,850,26.92235294117647,Explainable AI,Low,Low
a guide to explainable ai  artificial intelligence masterclass for beginners,jovian,12179,345,24,2023-02-21,39.18,https://www.youtube.com/watch?v=vNup3PygoWI,0.0302980540274242,789,15.435994930291509,Artificial Intelligence,Low,Low
introduction to explainable ai ml tech talks,tensorflow,58077,1239,25,2021-07-15,45.75,https://www.youtube.com/watch?v=6xePkn3-LME,0.0217642095838283,1375,42.23781818181818,Explainable AI,Low,Low
stanford seminar  humancentered explainable ai from algorithms to user experiences,stanford online,20599,449,0,2023-03-04,58.23,https://www.youtube.com/watch?v=ZxPV_KVq-tI,0.0217971746201271,778,26.47686375321337,Data Structures and Algorithms,Low,Low
applied generative  ai master program by mrssasmitha,durga software solutions,257,2,0,2025-03-03,91.35,https://www.youtube.com/watch?v=8VoyXrNFvRI,0.0077821011673151,48,5.354166666666667,Other,Low,Low
explainable ai using shap  explainable ai for deep learning  explainable ai for machine learning,unfold data science,4677,152,12,2024-06-19,20.65,https://www.youtube.com/watch?v=chjB-agAgPE,0.0350652127432114,305,15.334426229508196,Machine Learning,Low,Low
what is predictive analytics  how does predictive analytics work  data analytics  simplilearn,simplilearn,45766,553,2,2023-07-17,14.77,https://www.youtube.com/watch?v=tdV9L3C-hxQ,0.012126906437093,643,71.17573872472784,Predictive Analytics,Low,Low
what is predictive analytics transforming data into future insights,techtalk,96124,1033,16,2020-03-27,3.35,https://www.youtube.com/watch?v=cVibCHRSxB0,0.0109129873912862,1850,51.95891891891892,Predictive Analytics,Low,Low
the fundamentals of predictive analytics  data science wednesday,decisive data,176588,3323,0,2018-03-02,5.23,https://www.youtube.com/watch?v=4y6fUC56KPw,0.0188178132149409,2606,67.76208749040676,Data Science,Low,Low
what is predictive analytics  data analytics  techcanvass,techcanvass,8443,111,2,2022-06-28,10.77,https://www.youtube.com/watch?v=Zo_qcw7Etrk,0.0133838682932606,1027,8.221032132424538,Predictive Analytics,Low,Low
prescriptive vs descriptive vs predictive analytics  in hindi,code tute,104106,2953,147,2020-10-02,7.17,https://www.youtube.com/watch?v=EQEhgQddbZw,0.0297773423241695,1661,62.67670078266105,Predictive Analytics,Low,Low
predictive analysis using python  learn to build predictive models  python training  edureka,edureka,228331,3968,76,2020-05-18,27.62,https://www.youtube.com/watch?v=Cx8Xie5042M,0.017711129894758,1798,126.9916573971079,Python Programming,Medium,Low
what is predictive analytics,data science dojo,3283,59,3,2022-09-15,58.83,https://www.youtube.com/watch?v=0ThP9tsFsF4,0.0188851660067011,948,3.463080168776372,Predictive Analytics,Low,Low
simple linear regression analysis for beginners  basic predictive analytics,adam finer  learn bi online,21779,642,32,2021-09-23,10.55,https://www.youtube.com/watch?v=hxrM8LJ-27w,0.030947242756784,1305,16.68888888888889,Predictive Analytics,Low,Low
online  physical training course  in data management and analysis using spss and ai,norwegian research training institute,389,11,5,2025-03-03,9.75,https://www.youtube.com/watch?v=sJhB07cNRPQ,0.0411311053984575,48,8.104166666666666,Other,Low,Low
why do companies use predictive analytics,frankfurt school of finance  management,17138,59,1,2016-09-07,2.0,https://www.youtube.com/watch?v=J11FMQLkYfM,0.0035009919477185,3147,5.445821417222752,Predictive Analytics,Low,Low
spmsoftware project management with real life examples,gate smashers,554269,9320,163,2022-07-22,10.63,https://www.youtube.com/watch?v=b6mcMkQONic,0.0171090210709962,1003,552.6111665004985,Software Project Management,Medium,Low
introduction to project management in software engineering  software project managementsimplilearn,simplilearn,4435,53,1,2024-07-11,16.58,https://www.youtube.com/watch?v=YITEaLx_56g,0.0121758737316798,283,15.671378091872793,Software Engineering,Low,Low
software project management  why its different,projectmanager,110918,623,18,2014-05-05,4.52,https://www.youtube.com/watch?v=TYBVAvWkG6M,0.0057790439784345,4003,27.70871846115413,Software Project Management,Low,Low
project management tutorial 12 years of experience in 45 minutes,it project managers,717813,18621,576,2022-07-13,45.15,https://www.youtube.com/watch?v=4C5LYI1DLR4,0.0267437340923053,1012,709.3013833992095,Software Project Management,Medium,Low
software project management how to manage a software development project,dan martell,99121,1258,97,2017-08-21,10.22,https://www.youtube.com/watch?v=Y7sJwlyuoWw,0.0136701607126643,2799,35.4130046445159,Software Project Management,Low,Low
project management full course in 8 hours  project management training  simplilearn,simplilearn,1969742,32513,263,2021-02-13,486.1,https://www.youtube.com/watch?v=uWPIsaYpY7U,0.0166397426668061,1527,1289.9423706614275,Software Project Management,High,Medium
1 software project management concepts  introduction of spm  acp spm,happy coding,1460,37,10,2024-11-21,69.53,https://www.youtube.com/watch?v=uuWU9gesYtM,0.0321917808219178,150,9.733333333333333,Software Project Management,Low,Low
employee management system in python  python tutorial in tamil  python project in tamil,btree systems,353,13,2,2025-03-03,52.7,https://www.youtube.com/watch?v=pJy001vnISA,0.0424929178470254,48,7.354166666666667,Python Programming,Low,Low
se 31 project management spectrum  4ps with examples,cs  it tutorials by vrushali,47847,681,17,2023-03-29,5.4,https://www.youtube.com/watch?v=f4uKk_gPOk4,0.0145881664472171,753,63.54183266932271,Software Project Management,Low,Low
complete cd compiler design in one shot  semester exam  hindi,knowledgegate by sanchit sir,422702,5296,1000,2024-01-11,441.78,https://www.youtube.com/watch?v=OQCjakjCJu4,0.0148946539169438,465,909.0365591397848,Compiler Design,Medium,Low
lec2 phases of compiler with examples  compiler design,gate smashers,1149727,19916,346,2020-09-18,14.55,https://www.youtube.com/watch?v=PT9iWM80PDU,0.0176233140562933,1675,686.4041791044776,Compiler Design,Medium,Low
introduction to compiler design,neso academy,441197,4406,103,2022-03-26,14.32,https://www.youtube.com/watch?v=5ZmFlxrNaN8,0.0102199244328497,1121,393.5744870651204,Compiler Design,Medium,Low
modernizing compiler design for carbon toolchain  chandler carruth  cppnow 2023,cppnow,59771,1438,68,2023-08-17,95.2,https://www.youtube.com/watch?v=ZI198eFghJk,0.0251961653644744,612,97.66503267973856,Compiler Design,Low,Low
complete cd compiler design in one shot 4 hours in hindi,5 minutes engineering,87688,2141,185,2024-01-01,225.33,https://www.youtube.com/watch?v=7ICf62fp_4I,0.026525864428428,475,184.60631578947368,Compiler Design,Medium,Low
introduction to compiler design  language processing system,the gatehub,230368,1836,53,2023-12-21,15.43,https://www.youtube.com/watch?v=Cb46_P12bMY,0.0081999236005,486,474.0082304526749,Compiler Design,Medium,Low
what is a compiler,maanu_tutorials,434,0,0,2025-03-03,0.73,https://www.youtube.com/watch?v=_mEgSxmpJeE,0.0,48,9.041666666666666,Compiler Design,Low,Low
compiler design one shot video  unit 1  aktu exams important topics  cd imp topics,multi atoms,27205,488,138,2024-01-20,41.2,https://www.youtube.com/watch?v=nzfFjhq2rjc,0.0230104760154383,456,59.66008771929825,Compiler Design,Low,Low
