Title,Uploader,Views,Likes,Comments,Upload Date,Duration (Seconds),Duration (Minutes),Tags,URL
What Is AI Ethics | AI Ethics Foundation | How to Implement AI Ethics | Edureka,edureka!,7633,112,4,08-05-2024,597,9.95,"yt:cc=on, AI, Artificial Intelligence, AI Ethics, Trustworthy AI, ethics, augment human intelligence, ethics of AI, ethics of artificial intelligence, governance, ethical principles, AI policy, AI regulations, Responsible AI, Responsible Artificial Intelligence, ChatGpt, Google Gemini, Gemini, equality, inclusion, inequality, privacy, regulation, edureka",https://www.youtube.com/watch?v=COgvUFGLPCs
What is AI Ethics?,IBM Technology,128562,2157,76,30-09-2021,370,6.17,"AI, Artificial Intelligence, AI Ethics, Trustworthy AI, ethics, augment human intelligence, IBM, IBM Cloud",https://www.youtube.com/watch?v=aGwYtUzMQUk
AI Ethics | Ethics Defined,McCombs School of Business,10805,92,4,06-09-2024,210,3.5,,https://www.youtube.com/watch?v=6yDr7CWLJ8c
Artificial intelligence and its ethics | DW Documentary,DW Documentary,2001606,10479,1200,14-08-2019,2546,42.43,"Documentary, Documentaries, documentaries, DW documentary, DW documentary 2019, full documentary, documentary 2019, DW, beyond the news, Artificial Intelligence, ethics, humanity, space, weapon systems, AI, AI documentary, artificial intelligence documentary, chatbot, robot, robot documentary, arms race, AI surveillance, robot factory",https://www.youtube.com/watch?v=Izd2qOgOGQI
Artificial Intelligence Class 9 Chapter 1 | Ethics of Artificial Intelligence - Introduction to AI,Magnet Brains,110601,2491,349,10-08-2021,2397,39.95,"artificial intelligence class 9 chapter 1, introduction to ai, ethics of artificial intelligence, artificial intelligence class 9 unit 1.5, artificial intelligence, artificial intelligence class 9th, artificial intelligence class 9 cbse chapter 1, ai codes of ethics, moral issues, morality of developer, data privacy, data from smartphones, ai bais, virtual assistance, ai access, ai creates unemployment, ai for kids, artificial intelligence class 9 in hindi, magnet brains",https://www.youtube.com/watch?v=BjdpKNRVuvY
Artificial Intelligence and Ethics | StudyIQ IAS,StudyIQ IAS,92699,2764,86,26-11-2022,1622,27.03,"Artificial Intelligence, Artificial Intelligence and Ethics, artificial intelligence robot, artificial intelligence and machine learning, artificial intelligence projects, what is artificial intelligence, artificial intelligence explained, types of artificial intelligence, artificial intelligence for beginners, UPSC Current Affairs Questions, UPSC Current Affairs Daily, UPSC Current Affairs News, StudyIQ Current Affairs, current affairs for UPSC, studyiq, study iq",https://www.youtube.com/watch?v=kyIf3OwcC9c
"AI Is Dangerous, but Not for the Reasons You Think | Sasha Luccioni | TED",TED,1325282,25273,2000,06-11-2023,619,10.32,"TEDTalk, TEDTalks, TED Talk, TED Talks, TED, environment, technology, AI, future, data",https://www.youtube.com/watch?v=eXdVDhOGqoE
"The Ethics of AI│Stuart J. Russell (University of California, Berkeley, Professor)",World Knowledge Forum,21958,665,41,04-01-2025,1907,31.78,,https://www.youtube.com/watch?v=KiT0T12Yyno
Ethical AI,Unitarian Society Santa Barbara,27,2,0,03-03-2025,4376,72.93,,https://www.youtube.com/watch?v=HE0-TWTwiO0
Ethics of AI: Challenges and Governance,UNESCO,78807,866,0,06-02-2023,412,6.87,"AI, artificial intelligence, ethics, ethics of AI, ethics of artificial intelligence, governance, ethical principles, AI policy, AI regulations, UNESCO, equality, inclusion, inequality, privacy, regulation, Recommendation on the Ethics of Artificial Intelligence",https://www.youtube.com/watch?v=VqFqWIqOB1g
Big Data In 5 Minutes | What Is Big Data?| Big Data Analytics | Big Data Tutorial | Simplilearn,Simplilearn,1922215,34503,2000,10-12-2019,312,5.2,"big data, what is big data, what is big data and how does it work, big data hadoop, what is hadoop, what is hadoop and big data, what is hadoop and how does it work, why hadoop, how hadoop works, big data analytics, big data use cases, hadoop use cases examples, hadoop, big data tutorial for beginners, hadoop tutorial, big data training, hadoop training, simplilearn big data, simplilearn hadoop, simplilearn, big data introduction, hadoop and big data, big data course",https://www.youtube.com/watch?v=bAyrObl7TYE
Big Data Analytics | What Is Big Data Analytics? | Big Data Analytics For Beginners | Simplilearn,Simplilearn,175040,2791,56,08-05-2019,1709,28.48,"Big Data analytics, what is Big Data analytics, Big Data analytics tutorial, Big Data tutorial for beginners, Big Data analytics for beginners, Big Data analytics course, introduction to Big Data analytics, Big Data analysis tutorial, Big Data tutorial, introduction to Big Data, introduction to Big Data and hadoop, introduction to Big Data tutorial, Big Data, Big Data hadoop tutorial for beginners, hadoop tutorial, hadoop simplilearn, simplilearn",https://www.youtube.com/watch?v=bY6ZzQmtOzk
Introduction to Big Data Analytics 🔥,Perfect Computer Engineer,272477,4338,161,13-11-2020,500,8.33,"big data analytics, what is big data analytics, big data analytics tutorial, big data tutorial for beginners, big data analytics for beginners, big data analytics course, introduction to big data analytics, big data analysis tutorial, big data tutorial, introduction to big data, introduction to big data tutorial, big data, big data in hindi, big data analytics in hindi",https://www.youtube.com/watch?v=I_ku0D4uQzQ
Big Data & Hadoop Full Course - Learn Hadoop In 10 Hours | Hadoop Tutorial For Beginners | Edureka,edureka!,1480614,16817,192,01-09-2019,37657,627.62,"yt:cc=on, big data and hadoop full course, big data full course, hadoop full course, hadoop tutorial for beginners, hadoop tutorial, learn hadoop, learn big data, big data hadoop, big data, hadoop, big data tutorial, big data tutorial for beginners, big data hadoop tutorial, big data and hadoop, hadoop complete tutorial, what is hadoop, hadoop training, big data training, big data analytics, hadoop ecosystem, hadoop architecture, edureka, big data edureka, hadoop edureka",https://www.youtube.com/watch?v=1vbXmCrkT3Y
Big Data Analytics Explained with Examples in Hindi,5 Minutes Engineering,91660,1612,28,06-01-2023,360,6,,https://www.youtube.com/watch?v=iW0hPuvuKOE
Big Data Engineering Full Course Part 1 | 17 Hours,The Data Tech,312885,7373,209,28-08-2023,34313,571.88,"bigdata, dataengineering, apache hadoop, apache spark, how to learn big data, big data course, big data free course, thedatatech, the data tech, apache hive, bigdata with cloud, dataengineering with cloud, data engineering with aws, big data with google cloud, big data with azure, big data resume preparation, big data interview question, big data solution architect course, best big data analytics courses online, big data bootcamp course online, big data and data analytics course",https://www.youtube.com/watch?v=Tyg1FVNq40g
Big Data Analytics Explained | What Is Big Data Analytics? | Big Data Tutorial | Simplilearn,Simplilearn,19133,301,7,29-06-2022,988,16.47,"big data analytics, what is big data analytics, big data, big data analytics lecture, big data analytics playlist, big data 2022, big data analytics career, big data analytics explained, Big Data Analytics for Beginners, Big Data Analytics tools, Big Data Explained, simplilearn hadoop, Big Data Analytics Example, Big Data Analytics Explained, Big Data Tutorial for beginners, Big Data Certification, simplilearn",https://www.youtube.com/watch?v=h78258SRS9Y
Lec-128: Introduction to BIG Data in Hindi | Small Data Vs BIG Data | Real Life Examples,Gate Smashers,567129,9606,316,02-06-2019,764,12.73,"big data in hindi, big data hadoop, big data analytics, big data definition, nta net 2022, what is big data, what is big data and how does it work, what is hadoop, what is hadoop and big data, why hadoop, hadoop example, big data use cases, hadoop, hadoop training, simplilearn hadoop, big data training videos, big data analytics tutorial, big data training online, big data online course, big data certification, big data online training, bigdata, big data technologies",https://www.youtube.com/watch?v=LOuAOZWJ9RA
Big Data Analytics : How to connect Azure Storage with Power BI | #sqlschool,SQL School,117,11,1,02-03-2025,2143,35.72,"SQL School, SequelSchool, SQL School Trainings, SQL School Videos, SQL School Projets, Best Trainings, SQL Jobs, Best SQL Videos",https://www.youtube.com/watch?v=dSycGJPC-l4
Big Data Analytics | Big Data Explained | Big Data Tools & Trends | Big Data Training | Edureka,edureka!,146497,2130,52,29-06-2018,2163,36.05,"yt:cc=on, Big Data Analytics, Big Data Analytics for Beginners, Big Data Analytics tutorial, Big Data Analytics tutorial for beginners, What is Big Data, Big Data Explained, Big Data Analytics tools, Big Data Analytics applications, Big Data Analytics Career, Big Data Analytics Example, Big Data Analytics Explained, Big Data Tutorial, Big Data Tutorial for beginners, Big Data Certification, big data edureka, hadoop edureka, edureka, big data training, hadoop training",https://www.youtube.com/watch?v=k7zu3NXEiGY
What is Augmented Reality (AR)?,IBM Technology,23859,453,9,02-10-2024,312,5.2,"IBM, IBM Cloud, augmented reality, AR, digital content, real-world environment, virtual reality, VR, mixed reality, marker-based, markerless, enhanced product visualization, in-store navigation, seamless omnichannel integration, AI, Artificial Intelligence",https://www.youtube.com/watch?v=QpbJwad6v_s
What is Augmented Reality (AR) In 60 Seconds,Bernard Marr,216558,2162,66,09-02-2021,78,1.3,"#AR, #AugmentedReality, #Tech, #Technology, #TechTrends",https://www.youtube.com/watch?v=XPNUmcEOYW0
Augmented Reality (AR) and Virtual Reality (VR) Explained |,Cdr Sh Pallikkal,220007,4651,90,09-09-2020,357,5.95,"Augmented Reality, Virtual Reality, ARvsVR, AR and VR applications",https://www.youtube.com/watch?v=h3rKvsFTfPA
Augmented Reality for Advertising,UniteAR: Augmented Reality,49088,161,5,05-12-2019,24,0.4,"Augmented Reality, Augmented Reality Advertising, AR for Marketing",https://www.youtube.com/watch?v=2tPljGrlccY
I Tried Real Augmented Reality Glasses!,Marques Brownlee,5935582,146330,7100,01-11-2024,1229,20.48,"augmented reality, AR, AR glasses, Meta Orion, Snapchat spectacles, Snapchat AR spectacles, MKBHD",https://www.youtube.com/watch?v=G0eKzU_fV00
Augmented Reality Zoo,Go to Magic,27539264,43411,792,21-06-2015,247,4.12,"augmented reality, ar, kids zone, augmented reality company, augmented reality marketing, augmented reality education, virtual zoo, virtual animals, augmented reality animals, augmented reality zoo, ar zoo, augmented reality event, zoo, guerilla marketing, amusment zone, augmented reality app, augmented reality solution, augmented reality software, kids space, augmented reality theme park, augmented reality show",https://www.youtube.com/watch?v=Xmpe1uYTDgI
"The Rise Of Technology-Augmented Reality(AR), Virtual Reality(VR) And Mixed Reality(MR) |Simplilearn",Simplilearn,751433,11561,170,03-04-2020,519,8.65,"augmented reality, virtual reality, mixed reality, immersive technology, rise of technology, ar, vr, mr, what is ar, what is augmented reality, augmented reality technology, what is vr, what is virtual reality, virtual reality technology, what is mr, mixed reality technology, ar vs vr ve mr, augmented reality vs virtual reality, ar vs vr technology, augmented reality explained, mixed reality explained, future technology, rise of immersive technology, simplilearn",https://www.youtube.com/watch?v=XLP4YTpUpBI
The Future of Augmented Reality (2030),Future Business Tech,76917,1217,62,19-11-2022,305,5.08,"augmented reality, augmented reality glasses, future business tech, future technology, 2030, the world in 2030, ar in education, ar",https://www.youtube.com/watch?v=D8V2nxeWHmI
Mario Circuit Looks COMPLETELY Different in the new Mario Kart #shorts,Ray's Nintendo Talk,52,16,0,04-03-2025,42,0.7,,https://www.youtube.com/watch?v=FgBw_SpRO0c
Explore Earth Augmented Reality Sample,Magic EdTech,89550,779,19,10-10-2017,93,1.55,"mobile, education, augmented reality, ar",https://www.youtube.com/watch?v=47GVkOv9RuA
Dad Wasn’t Ready for Virtual Reality,Daily Dose Of Internet,15625855,1070297,10000,15-07-2023,16,0.27,"Internet, Internet videos, Daily Dose, Animals, TikTok, Science, TikTok Compilation, Compilation, Daily Dose Of Internet",https://www.youtube.com/watch?v=-v9SWaYhKiQ
Worlds smallest 4K headset 😎 Visor.com #tech #vr #technology #virtualreality #insideout2,Immersed,190060229,4079326,7200,21-06-2024,15,0.25,,https://www.youtube.com/watch?v=-055GvEU7f0
Google Earth VR — Bringing the whole wide world to virtual reality,Google,4041437,26097,1800,16-11-2016,64,1.07,"google, earth, vr, virtual reality, daydream, htc vive, steam, valve, satellite",https://www.youtube.com/watch?v=SCrkZOx5Q1M
Virtual Reality is Not What You Think,DamiLee,435404,19232,1800,31-08-2023,925,15.42,"architecture, architecture student, architect, female architect, life of an architect, architecture life, architecture school, archinect, career, career in architecture, apple vision pro, augmented reality, keiichi matsuda, varjo, oculus quest 3, virtual reality headset, apple vr headset, AR, urbanism, futurism, future cities, cities of the future, smart cities",https://www.youtube.com/watch?v=wsFOLf1WvNs
How virtual reality tricks your brain,Vox,976520,31223,1200,22-12-2020,374,6.23,"virtual reality, oculus, oculus vr, oculus rift, oculus rift 2, Facebook, neurology, perception, the walking dead: saints and sinners, richie's plank experience, vr, illusion, stereopsis, oculus dreamdeck, immersion, immersive, VR fails, Vox.com, vox, explain, explainer, Kimberly Mas, Kim Mas",https://www.youtube.com/watch?v=ybyib5pAq7Y
What Is Virtual Reality (VR) In 60 Seconds,Bernard Marr,127500,1232,107,08-03-2021,89,1.48,"#VR, #VirtualReality, #Tech, #TechTrends, #Technology, #FutureTrends",https://www.youtube.com/watch?v=YLb1gnmsceA
"The Rise Of Technology-Augmented Reality(AR), Virtual Reality(VR) And Mixed Reality(MR) |Simplilearn",Simplilearn,751433,11561,170,03-04-2020,519,8.65,"augmented reality, virtual reality, mixed reality, immersive technology, rise of technology, ar, vr, mr, what is ar, what is augmented reality, augmented reality technology, what is vr, what is virtual reality, virtual reality technology, what is mr, mixed reality technology, ar vs vr ve mr, augmented reality vs virtual reality, ar vs vr technology, augmented reality explained, mixed reality explained, future technology, rise of immersive technology, simplilearn",https://www.youtube.com/watch?v=XLP4YTpUpBI
Clash of Clans 360: Experience a Virtual Reality Raid,Clash of Clans,104214132,1300574,40000,07-12-2015,83,1.38,"Raid, hog, rider, dragon, barbarian, archer, tower, clash, clans, Clash Of Clans, Virtual, Reality, Supercell, iOS, Android, Free, Game, Games, Village, Wizard, Download",https://www.youtube.com/watch?v=wczdECcwRw0
Augmented Reality (AR) and Virtual Reality (VR) Explained |,Cdr Sh Pallikkal,220007,4651,90,09-09-2020,357,5.95,"Augmented Reality, Virtual Reality, ARvsVR, AR and VR applications",https://www.youtube.com/watch?v=h3rKvsFTfPA
Virtual Reality Battle | Dude Perfect,Dude Perfect,52075594,524530,17000,06-03-2017,397,6.62,"Dude Perfect, dudeperfect, dude perfect, basketball, basketball trick shots, trick shots, trick shot, trickshot, epic, amazing, cool, crazy, funny, panda, dude perfect panda, iphone game, dude perfect game, virtual reality, mixed reality, virtual reality dude perfect, dude perfect battle, dude perfect video game battle, dude perfect video game, virtual archery, virtual space pirates, virtual bow and arrow, virtual ice fishing, virtual game, virtual finale",https://www.youtube.com/watch?v=evXDnRpgolc
What is Cloud Security?,IBM Technology,297803,4543,116,27-09-2019,617,10.28,"cloud computing security, cloud data security, cloud encryption, key management, encryption, devops, cloud-native, cloud migration, IaaS, PaaS, DBaaS, OSaaS, SecDevOps, data at rest, data in motion, Cloud Security Risk, CSaaS, ibm cloud security, ibm cloud, Cloud Security",https://www.youtube.com/watch?v=jI8IKpjiCSM
What Is Cloud Security? | Cloud Security Fundamentals | Cloud Computing Tutorial | Simplilearn,Simplilearn,7566,153,1,16-07-2024,599,9.98,"what is cloud security, cloud security fundamentals, cloud computing tutorial, cloud security, cloud security tools, what is cloud security in cloud computing, cloud security explained, cloud security course, cloud security engineer, cloud security architecture, cloud security challenges in cloud computing, cloud security in cyber security, cloud security roadmap, Key Aspects of Cloud Security, Cloud Security Threats, cloud computing course, simplilearn",https://www.youtube.com/watch?v=Qt9lhzFhW_c
13 Cyber Security Projects to get you HIRED (Updated 2025),UnixGuy | Cyber Security,14112,1179,161,03-03-2025,1252,20.87,"Cyber Secuity, Cyber, CyberSecurity, Information Security, cyber security career, interview, penetration testing, GRC, information security analyst",https://www.youtube.com/watch?v=CWtLdR2SxNY
FASTEST Way to Learn Cloud Security and ACTUALLY Get a Job (2025),UnixGuy | Cyber Security,40049,2020,348,27-12-2024,2069,34.48,"Cyber Secuity, Cyber, CyberSecurity, Information Security, cyber security career, interview, penetration testing, GRC, information security analyst",https://www.youtube.com/watch?v=r86YCwX_iU4
Cloud Security Tutorial For Beginners | What is Cloud Security?,Tech With Soleyman,25196,589,17,09-05-2024,965,16.08,"cloud security, what is cloud computing, cloud computing explained, what is cloud computing for beginners, what is cloud security, cloud computing, cloud security fundamentals, cloud security tutorial, cloud security architecture, what is cloud computing and how it works, cloud computing explained in simple terms, cloud security training, cloud computing security, cloud security challenges, aws cloud security, cloud security podcast",https://www.youtube.com/watch?v=sF014G2BUXM
Cloud Security Tutorial | Cloud Security Fundamentals | What is Cloud Security | Edureka,edureka!,177850,1585,30,07-04-2017,1565,26.08,"yt:cc=on, cloud security, cloud security tutorial, cloud computing security, cloud security fundamentals, cloud security architecture, cloud security training, cloud security challenges, cloud security project, cloud based security, aws cloud security, aws security, aws tutorial, aws training, aws certification, aws edureka, edureka, what is cloud security, cloud security certification",https://www.youtube.com/watch?v=0lw4KU5wHsk
Cloud Security Interview Questions and Answers | Scenario based Cloud Security Interview Questions,CyberPlatter,14900,361,7,24-06-2024,2830,47.17,"Cloud, Cloud Computing, Cloud security, Cloud engineer, Cloud security interview, cloud security interview questions, cloud security interview questions explained, cloud analyst, scenario based cloud questions, cloud questions, cloud interview, cloud interview questions, cloud interview questions and answers, scenario based cloud interview, scenario based interview, Cloud engineer interview, cloud engineer interview questions, cloud computing interview, CyberPlatter",https://www.youtube.com/watch?v=JsKqexbMJs8
Cloud Security Risks: Exploring the latest Threat Landscape Report,IBM Technology,45163,1344,57,01-10-2024,692,11.53,"IBM, IBM Cloud, cloud security, threat landscape, cross-site scripting, stolen credentials, phishing, business email compromise, multifactor authentication, pass keys, user training, cloud computing, vulnerability management, threat intelligence, dark web, cybersecurity, cloud threat, cloud risk, cloud breach, cloud protection, cloud security measures, security recommendations",https://www.youtube.com/watch?v=VK0GyUSDwQY
AWS re:Inforce 2019: The Fundamentals of AWS Cloud Security (FND209-R),Amazon Web Services,163643,2643,72,26-06-2019,2884,48.07,"AWS, Amazon Web Services, Cloud, cloud computing, AWS Cloud, AWS re:Inforce, AWS re:Inforce 2019, security, identity, compliance, cloud security, AWS security, cloud security community, learning conference, Detective Controls, Infrastructure Security, Data Protection, Incident Response, Governance, Risk, Compliance, security best practices, The Foundation, AWS re:Inforce 2019 Sessions, Session, FND209-R, Becky Weiss, 200 - Intermediate",https://www.youtube.com/watch?v=-ObImxw1PmI
Availity Modernizes Healthcare Technology through Collaboration with AWS | Amazon Web Services,Amazon Web Services,223,8,0,03-03-2025,165,2.75,"AWS, Amazon Web Services, Cloud, AWS Cloud, Cloud Computing, Amazon AWS, Migration, Modernization, Healthcare, Generative AI, Amazon Q, Amazon Q Business, Amazon Q Developer, AWS Training and Certification, AWS Professional Services, Availity",https://www.youtube.com/watch?v=IGfITij1GVY
The Cycle of Cyber Threat Intelligence,SANS Digital Forensics and Incident Response,121621,2037,29,03-09-2019,3627,60.45,"digital forensics, incident response, threat hunting, cyber threat intelligence, dfir training, dfir, learn digital forensics, learn computer forensics, forensic data, forensics artifacts, free digital forensics, free computer forensics, cti, FOR578",https://www.youtube.com/watch?v=J7e74QLVxCk
How to become a Cyber Threat Intel analyst,Cyber Intel with Gary Ruddell,12749,533,34,07-03-2024,151,2.52,"cyber, hacking, learning, osint, cti, cyber threat intel, crowdstrike, google tag, unit42",https://www.youtube.com/watch?v=3KFHOamRl-s
Creating a Threat Intelligence Program from Scratch Part 1,Prabh Nair,13094,275,14,22-08-2023,1814,30.23,"cybersecurity, threat intelligence, cyber threat intelligence, threat intelligence analyst, cyber threat intelligence explained, explainable threat intelligence, threat intelligence platform, threat intelligence job, what is cyber threat intelligence, threat intelligence sharing, threat hunting, threat intelligence tools, cyber threat hunting, threat intelligence feed, threat intelligence interview questions, threat hunting & threat intelligence, threat hunting techniques",https://www.youtube.com/watch?v=p7by_uWzdEg
What is Cyber Threat Intelligence,Relative Security,4788,63,3,06-09-2022,729,12.15,,https://www.youtube.com/watch?v=SNN0dAcfBAU
Introduction to Cyber Threat Intelligence | TryHackMe,Motasem Hamdan | Cyber Security & Tech,13467,234,10,16-10-2022,1594,26.57,,https://www.youtube.com/watch?v=OZ80zXwTh0g
What Is Cyber Threat Intelligence? || क्या है साइबर खतरे की खुफिया जानकारी?,Masters in ethical hacking 2.0,11608,349,38,03-02-2021,574,9.57,"masters in ethical hacking 2.0, masters in ethical hacking, am pachouri, What Is Cyber Threat Intelligence?, what is cyber threats, what is cyber threat intelligence, cybersecurity threat hunting, how to secure an organization, role of cyber security experts in an organization",https://www.youtube.com/watch?v=Z2ll8mg1mCY
What Is Cyber Threat Intelligence and How To Stand Out As Threat Intelligence Analyst,Hacker Valley Media,17998,263,15,04-04-2023,1758,29.3,,https://www.youtube.com/watch?v=eme2jfTeoVo
Cyber Threat Intelligence 101 - Types of Threat Intelligence 🌐🔍,Blue Team Resources,2158,40,2,01-09-2023,430,7.17,"Cybersecurity, Cyber threat intelligence, Cyber security, Threat intelligence, Information security, Cyber, Threat intel, Cybersecurity for beginners, Hacking, Security, Cyber threat intelligence analyst, Cyber threat hunting, Infosec, Threat hunting, Cyber threat intelligence explained, Information security analyst, Strategic threat intelligence, Tactical threat intelligence, Operational threat intelligence, Technical threat intelligence",https://www.youtube.com/watch?v=sSQ0vtoZspo
Unified security: Intune + Microsoft Defender for Endpoint – Microsoft Technical Takeoff,Windows IT Pro,648,11,0,04-03-2025,1798,29.97,,https://www.youtube.com/watch?v=FKWYvjkatho
Threat Intelligence Made Easy - SOC Experts,SOC Experts,55947,1649,102,26-04-2021,708,11.8,"SOC, SOC Experts, SOC Analyst, training, SOC Analyst Training, soc jobs, cybersecurity, cybersecurity jobs, cybersecurity interview questions, fresher job interview, fresher cybersecurity job interview, best way to give introduction, first job in cybersecurity, Cybersecurity for non- technical, information security for non-technical, how to get first cybersecurity job, how to get soc analyst job, cybersecurity job, security analyst job, Anand guru",https://www.youtube.com/watch?v=gt_qBvccvqE
But what is a neural network? | Deep learning chapter 1,3Blue1Brown,18756149,457380,7800,05-10-2017,1121,18.68,,https://www.youtube.com/watch?v=aircAruvnKk
Neural Networks Explained in 5 minutes,IBM Technology,348032,7546,115,24-05-2022,271,4.52,,https://www.youtube.com/watch?v=jmmW0F0biz0
Neural Network In 5 Minutes | What Is A Neural Network? | How Neural Networks Work | Simplilearn,Simplilearn,1544791,30836,1300,19-06-2019,345,5.75,"neural network, what is neural network, what is neural network in artificial intelligence, what is neural network in ai, how neural networks work, how deep neural networks work, introduction to neural networks, introduction to neural network in artificial intelligence, neural network tutorial, deep learning and neural networks, neural network explained, neural network explained easily, neural network in 5 minutes, deep learning, simplilearn deep learning, simplilearn",https://www.youtube.com/watch?v=bfmFfD2RIcg
Lecture 11 - Introduction to Neural Networks | Stanford CS229: Machine Learning (Autumn 2018),Stanford Online,192501,2381,65,17-04-2020,4814,80.23,"Stanford, Stanford Online, CS229, AI",https://www.youtube.com/watch?v=MfIjxPh6Pys
