Title,Uploader,Views,Likes,Comments,Upload Date,Duration (Seconds),Duration (Minutes),Tags,URL
Machine Learning for Everybody – Full Course,freeCodeCamp.org,8397276,83764,1800,26-09-2022,14033,233.88,,https://www.youtube.com/watch?v=i_LwzRVP7bg
Complete Machine Learning In 6 Hours| Krish Naik,Krish Naik,1124367,19654,466,28-05-2022,23872,397.87,"yt:cc=on, complete machine learning algorithms, AI Vs ML vs DL vs Data Science, Regression And Classification, Linear Regression Algorithm, Logistic Regression Algorithm, Linear Regression Practical Implementation, Ridge And Lasso Regression Practical Implementation, Naive Baye's Algorithms, Decision Tree Classification Algorithms, Hierarichal Clustering Algorithms, Silhoutte Clustering, krish naik complete machine learning playlist",https://www.youtube.com/watch?v=JxgmHe2NyeY
Machine Learning Full Course - Learn Machine Learning 10 Hours | Machine Learning Tutorial | Edureka,edureka!,3336201,59006,1300,22-09-2019,34712,578.53,"yt:cc=on, Machine Learning Full Course, machine learning, Machine Learning tutorial, learn machine learning, machine learning for beginners, Machine Learning tutorial for beginners, machine learning for beginner to advance, machine learning course, machine learning complete course, machine learning python, machine learning algorithms, edureka, edureka machine learning, edureka data science, edureka python, what is machine learning, machine learning edureka",https://www.youtube.com/watch?v=GwIo3gDZCVQ
All Machine Learning algorithms explained in 17 min,Infinite Codes,661710,29703,242,17-09-2024,989,16.48,"machine learning algorithms, machine learning, machine learning tutorial, what is machine learning, machine learning models explained, machine learning algorithms explained, machine learning basics, machine learning explained in 10 minutes, machine learning algorithms in python, machine learning tutorial for beginners, machine learning course, machine learning python, algorithms, introduction to machine learning, complete machine learning algorithms, data science, deep learning",https://www.youtube.com/watch?v=E0Hmnixke2g
Complete ML Machine Learning in one shot | Semester Exam | Hindi,KnowledgeGATE by Sanchit Sir,313207,5279,598,09-06-2024,25555,425.92,"knowledgegate, knowledge gate, knowledge gate sanchit jain, sanchit jain, GATE, NET, University Exam preparation, machine learning full course, machine learning playlist, machine learning rgpv, machine learning course, machine learning techniques aktu, machine learning techniques aktu one shot, machine learning one shot, machine learning one shot aktu, machine learning one shot in hindi, machine learning one shot sanchit jain, machine learning one shot knowledge gate",https://www.youtube.com/watch?v=2oGsCHlfBUg
Machine Learning | What Is Machine Learning? | Introduction To Machine Learning | 2024 | Simplilearn,Simplilearn,4910795,62068,2100,19-09-2018,472,7.87,"2022, 2023, ML, Machine Learning, basics of machine learning, cloud and machine learning, fundamentals of machine learning, gcp maching learning, getting started with machine learning, introduction to machine learning, machine learning, machine learning basics, machine learning for beginners, machine learning tutorial for beginners, machine learning with gcp, simplilearn, simplilearn machine learning, what is machine learning",https://www.youtube.com/watch?v=ukzFI9rgwfU
I can't STOP reading these Machine Learning Books!,Nicholas Renotte,756165,54628,192,24-01-2023,25,0.42,,https://www.youtube.com/watch?v=vdRp_w9f-qM
All Machine Learning Concepts Explained in 22 Minutes,Infinite Codes,140515,7037,74,27-11-2024,1342,22.37,"machine learning, machine learning tutorial, machine learning course, machine learning tutorial for beginners, machine learning python, machine learning algorithms, what is machine learning, machine learning for beginners, learn machine learning, machine learning basics, python machine learning, machine learning full course, introduction to machine learning, learn machine learning with python, machine learning explained, machine learning terms, ml terms, data science terms",https://www.youtube.com/watch?v=Fa_V9fP2tpU
How Self-Driving Cars Work – The AI Behind Autonomous Vehicles! 🤖 #AI #ai #machinelearning #tesla,Scishorts,576,10,1,02-03-2025,57,0.95,,https://www.youtube.com/watch?v=8_rd0U_6EWo
The Complete Machine Learning Roadmap,Programming with Mosh,421741,14835,428,18-07-2024,324,5.4,"machine learning roadmap, machine learning, ml roadmap, ml career path, complete machine learning roadmap, machine learning python, roadmap for machine learning, code with mosh, programming with mosh, mosh hamedani, programming, coding, machine learning engineer, ai engineer roadmap, data science, tech career",https://www.youtube.com/watch?v=7IgVGSaQPaw
MIT Introduction to Deep Learning | 6.S191,Alexander Amini,31694,1847,95,03-03-2025,4165,69.42,"deep learning, mit, artificial intelligence, neural networks, machine learning, introduction to deep learning, intro to deep learning, 6s191, 6.s191, mit 6.s191, mit 6s191, mit deep learning, alexander amini, amini, lecture 1, ava soleimany, tensorflow, computer vision, deepmind, openai, basics, introduction, deeplearning, tensorflow tutorial, what is deep learning, deep learning basics, deep learning python, andrew ng",https://www.youtube.com/watch?v=alfdI7S6wCY
Deep Learning | What is Deep Learning? | Deep Learning Tutorial For Beginners | 2023 | Simplilearn,Simplilearn,1453498,24064,1000,03-06-2019,351,5.85,"Deep Learning, what is Deep Learning, Deep Learning ai, what is Deep Learning and Machine Learning, what is Deep Learning in Artificial Intelligence, Deep Learning tutorial, what is Deep Learning and neural networks, what is Deep Learning in simple explanation, what is Deep Learning and how it works, introduction to Deep Learning, Deep Learning explained, Deep Learning neural networks explained, Deep Learning in 5 minutes, simplilearn Deep Learning, simplilearn",https://www.youtube.com/watch?v=6M5VXKLf4D4
But what is a neural network? | Deep learning chapter 1,3Blue1Brown,18755898,457376,7800,05-10-2017,1121,18.68,,https://www.youtube.com/watch?v=aircAruvnKk
Deep Learning Indepth Tutorials In 5 Hours With Krish Naik,Krish Naik,409417,8714,431,22-05-2022,20540,342.33,"yt:cc=on, deep learning indepth tutorials, ann tutorial, cnn tutorial, loss function tutorials, optimizers tutorials in depth intuition",https://www.youtube.com/watch?v=d2kxUVwWWwU
Deep Learning Crash Course for Beginners,freeCodeCamp.org,878747,20595,323,30-07-2020,5138,85.63,"deep, learning, deep learning tutorial, python, machine learning tutorial, deep learning, deeplearning, what is deep learning, deep learning tutorial for beginners, deep learning tensorflow, deep learning full course, deep learning introduction, intro to machine learning, basics of deep learning, deep learning crash course",https://www.youtube.com/watch?v=VyWAvY2CF9c
PyTorch for Deep Learning & Machine Learning – Full Course,freeCodeCamp.org,2280290,49078,1300,06-10-2022,92245,1537.42,,https://www.youtube.com/watch?v=V_xro1bcAuA
Deep Learning Full Course - Learn Deep Learning in 6 Hours | Deep Learning Tutorial | Edureka,edureka!,573942,9779,154,08-09-2019,21746,362.43,"yt:cc=on, Deep Learning Full Course, Deep Learning Tutorial, deep learning tutorial for beginners, deep learning for beginners, tensorflow tutorial, tensorflow tutorial for beginners, tensorflow deep learning tutorial, deep learning complete tutorial, deep learning algorithms, deep learning applications, deep learning frameworks, deep learning training, edureka, deep learning, deep learning edureka, what is deep learning, deep learning with tensorflow, tensorflow edureka",https://www.youtube.com/watch?v=DooxDIRAkPA
MIT Introduction to Deep Learning (2024) | 6.S191,Alexander Amini,956615,20468,418,29-04-2024,4197,69.95,"deep learning, mit, artificial intelligence, neural networks, machine learning, introduction to deep learning, intro to deep learning, 6s191, 6.s191, mit 6.s191, mit 6s191, mit deep learning, alexander amini, amini, lecture 1, ava soleimany, tensorflow, computer vision, deepmind, openai, basics, introduction, deeplearning, tensorflow tutorial, what is deep learning, deep learning basics, deep learning python, andrew ng",https://www.youtube.com/watch?v=ErnWZxJovaM
IIT Kanpur Certification Program | PYTHON for AIML and Deep Learning | 1st to 27th June 2025 |,Online Courses IIT Kanpur,46,0,0,02-03-2025,56,0.93,,https://www.youtube.com/watch?v=dh2qi_1N0Q0
Deep Learning With PyTorch - Full Course,Patrick Loeber,802972,16791,473,24-02-2021,16542,275.7,"Python, Machine Learning, ML, PyTorch, Deep Learning, DL, Python DL Tutorial, PyTorch Tutorial, Tensorboard, PyTorch Course, Neural Network, Course, CNN, Linear Regression, Logistic Regression, DataLoader, Optimizer, Loss, Crossentropy, Activation Function, Softmax, Transfer Learning, Model, Training",https://www.youtube.com/watch?v=c36lUUr864M
What Is Artificial Intelligence? | Artificial Intelligence (AI) In 10 Minutes | Edureka,edureka!,1716979,32876,401,08-05-2019,675,11.25,"yt:cc=on, artificial intelligence, ai, AI In 10 Minutes, learn artificial intelligence, what is artificial intelligence, types of artificial intelligence, artificial intelligence tutorial, ai tutorial, what is ai, introduction to artificial intelligence, artificial intelligence explained, ai explained, ai applications, introduction to ai, what is ai technology, edureka, ai edureka, deep learning edureka, artificial intelligence for beginners, Artificial intelligence edureka",https://www.youtube.com/watch?v=oV74Najm6Nc
What Is AI? | Artificial Intelligence | What is Artificial Intelligence? | AI In 5 Mins |Simplilearn,Simplilearn,2997709,35521,2800,30-04-2019,328,5.47,"what is ai, artificial intelligence, what is artificial inteliigence, ai for beginners, artificial intelligence applications, artificial intelligence basics, artificial intelligence explained, artificial intelligence for beginners, artificial intelligence tutorial, introduction to ai, introduction to artificial intelligence, machine learning, simplilearn, types of artificial intelligence, what is ai technology, what is artificial intelligence, what is deep learning",https://www.youtube.com/watch?v=ad79nYk2keg
What is Artificial Intelligence? | ChatGPT | The Dr Binocs Show | Peekaboo Kidz,Peekaboo Kidz,1573716,9098,0,13-01-2023,342,5.7,"dr binocs, peekaboo kidz, dr bincos what is ai, dr binocs artificial intelligence, dr binocs what is artificial intelligence, peekaboo kidz what is ai, dr binocs chat gpt, what is ai, chatgpt, chat gpt, artificial intelligence, ai, machine learning, benefits of ai, uses of ai in our daily life, benefits of artificial intelligence, uses of artificial intelligence, dr binocs show, the dr binocs show, binocs, dr binocs robot, robot, videos for kids, online learning, peekaboo kids",https://www.youtube.com/watch?v=ttIOdAdQaUE
Complete AI Artificial Intelligence in one shot | Semester Exam | Hindi,KnowledgeGATE by Sanchit Sir,418539,7409,851,30-04-2024,20686,344.77,"knowledge gate sanchit jain, sanchit jain, University Exam preparation, artificial intelligence, artificial intelligence full course, artificial intelligence course, artificial intelligence one, artificial intelligence one shot, artificial intelligence one shot revision, artificial intelligence one shot for semester exam, class 12 artificial intelligence one shot, class 10th artificial intelligence one shot, ai one shot aktu, ai one shot class 12, ai one shot class 9",https://www.youtube.com/watch?v=yiXAmkimZRQ
Artificial Intelligence (Got 1st prize ),EASY LEARN: Lata A. Patil,190611,2917,0,01-04-2023,81,1.35,,https://www.youtube.com/watch?v=sZzszp7wOPE
Artificial Intelligence Full Course | Artificial Intelligence Tutorial for Beginners | Edureka,edureka!,4151225,80489,925,02-06-2019,17570,292.83,"yt:cc=on, Artificial Intelligence Full Course, artificial intelligence, Artificial Intelligence Tutorial for Beginners, Artificial Intelligence Tutorial, Artificial Intelligence course, artificial intelligence crash course, artificial intelligence course for beginners, artificial intelligence training, edureka, what is artificial intelligence, artificial intelligence edureka, artificial intelligence for beginners, ai tutorial, Ai tutorial for beginners",https://www.youtube.com/watch?v=JMUxmLyrhSk
What is Artificial Intelligence With Full Information? – [Hindi] – Quick Support,Quick Support,3114441,86782,2100,07-11-2020,649,10.82,"What is Artificial Intelligence With Full Information?, What is Artificial Intelligence in Hindi?, Artificial Intelligence Kya Hain?, What is artificial intelligence with examples? What is artificial intelligence in computer?, Artificial intelligence Animation Video, Benefits of artificial intelligence, Artificial intelligence future, Who started AI?, Where is Artificial Intelligence used?, What is the disadvantage of Artificial Intelligence?, Types of artificial intelligence",https://www.youtube.com/watch?v=iyb38dzetRk
Harvard CS50’s Artificial Intelligence with Python – Full University Course,freeCodeCamp.org,3156478,89407,1300,10-08-2023,42682,711.37,,https://www.youtube.com/watch?v=5NgNicANyqM
"Getting Rich, Artificial Intelligence, Future Predictions & Risks ft. SHARK TANK INDIA Season 4",Him-eesh Madaan,985203,34665,984,21-12-2024,3209,53.48,"shark tank india season 4, anupam mittal, ritesh agarwal, aman gupta, become rich, earn money, mind power, how to become rich, how to become successful, how to become a millionaire, get rich, motivational video for success, habits of successful people, indian billionaires, Successful habits of rich people, How to start a business in india, how to earn money, success motivation, how to become rich in 20's, himeesh madaan",https://www.youtube.com/watch?v=J3mfInWmHFw
What is Mistral AI? #ai #aitrending #artificialintelligence,Deep Ai,410,9,1,02-03-2025,18,0.3,"web designing, web developement, wordpress website, how to install wordpress, cpanel, wordpress installing in cpanel, what is wordpress",https://www.youtube.com/watch?v=fEixnkCTN3s
What is Data Science?,IBM Technology,655754,14490,271,13-06-2022,470,7.83,"IBM, IBM Cloud, Data Science, DataScience, Data Fabric, Data Mining, Data CLeaning, Data, Machine Learning, ML, Advanced Analytics, Computer Science, Math, Mathematics, Business Analyst, data engineer, data scientist, business expertise, business solutions, noisy data, business problems, Luv aggarwal, Visualization, Exploration, Data Exploration, Lightboard",https://www.youtube.com/watch?v=RBSUwFGa6Fk
How to learn Data Science? In Short,Apna College,850456,65472,239,19-10-2023,47,0.78,"C++, C++ coding, C++ full course, C++ placement course, how to code, programming, college placement course, C++ language, java, java language, java full course, java placement, java code, java coding",https://www.youtube.com/watch?v=JIbfzmt2LuY
Data Science In 5 Minutes | Data Science For Beginners | What Is Data Science? | Simplilearn,Simplilearn,4350676,61408,1100,04-12-2018,278,4.63,"data science, what is data science, data science for beginners, data scientist, data science tutorial, data science in 5 minutes, what is data science for beginners, data science applications, introduction to data science, data science with python, what does data scientist do, A Day In The Life Of A Data Scientist, data science explained, learn data science, data science tutorial for beginners, data science 101, simplilearn data science, simplilearn",https://www.youtube.com/watch?v=X3paOmcrTjQ
Data Analytics vs Data Science,IBM Technology,615680,12689,220,08-11-2023,390,6.5,"IBM, IBM Cloud",https://www.youtube.com/watch?v=dcXqhMqhZUo
🔥Salary of a Data Scientist | How Much Do Data Scientists Make? | Intellipaat #Shorts #DataScientist,Intellipaat,392615,13915,34,18-08-2024,25,0.42,"salary of data scientist, salary of data scientist in india, data scientist salary, data scientist salary in india, how much does a data scientist earn, data science salary, data science salary in india for freshers, data science entry level salary, Data Science Earnings, Tech Careers, Data Scientist Income, Data Scientist Salary Insights, Data Science Industry, Salary of a Data Scientist, Tech Industry Salaries, Shorts, Shorts Video, Shorts Feed, Shorts Feed Viral, Intellipaat",https://www.youtube.com/watch?v=A_MzXThZPgI
🔥Salary of Data Scientist | Data Science Professional Salary | Simplilearn #shorts,Simplilearn,76368,2472,2,07-10-2024,59,0.98,"data scientist salary, data scientist, data science, data scientist salary in india, data science salary, salary of data scientist, data scientist salary in usa, data scientist job, data scientist career, self-taugh data scientist, data analyst salary, data science jobs, data scientist salary usa, data engineer salary, data scientist salary per month, entry level data scientist salary, salary of data scientist in india, data analytics",https://www.youtube.com/watch?v=mAMbPhKqrcY
"Reality behind data science, machine learning jobs",codebasics,1913368,81041,588,16-02-2022,53,0.88,"data science and machine learning, data scientist jobs, data science jobs, data scientist day in the life, data scientist job description, yt:cc=on, data science, data scientist salary, data scientist, data analytics, career advice, career advice for young people, Data science for beginners, python data science, data science jobs for freshers, Data scientist salary in india, data science career, amazon data scientist, data science job, data scientist job",https://www.youtube.com/watch?v=R6u5EBWAssY
What Do Data Scientists ACTUALLY Do? | Life as a Data Scientist | Intellipaat #Shorts #DataScientist,Intellipaat,63799,2158,19,11-10-2024,22,0.37,"What do Data Scientists Do, Life as a data scientist, data scientist job description, data scientist skills, What do data scientists do all day at the work, data scientist career, data scientist work in company, data scientist work, data science, data scientist, role of a data scientist, work of a data scientist, what is the role of data scientist, tech jobs, IT jobs, Data Science jobs, Highet paying tech jobs, #shorts, Tech shorts, Data Science shorts, YT shorts, intellipaat",https://www.youtube.com/watch?v=fG_ETXqi_So
Google Launches Free Data Science Agent in Colab Powered By Gemini,Growth Learner,326,7,0,04-03-2025,708,11.8,"AI tools, AI data analysis, data science, data scientist, data science for beginners, data science ai agent, data science ai, google colab data science, google colab data analysis, data analytics in google colab, data analysis with google colab, ai agent for data science, ai for data science, ai tools for data science, ai tools for data scientist, python for data science, data science python, data science with python, data science using python, gemini",https://www.youtube.com/watch?v=1Lq2xzqj_S0
Intro to Data Science: What is Data Science?,Steve Brunton,109740,1574,40,06-06-2019,495,8.25,"Data Science, Machine Learning, Optimization, Regression, Modeling, Neural Networks, Classification, Visualization, Data Analytics, Data, Data-driven science, Big Data",https://www.youtube.com/watch?v=FsSrzmRawUg
Computer Vision Explained in 5 Minutes | AI Explained,AI Sciences,135489,2239,22,09-08-2021,342,5.7,"data engineer, data science, Machine Learning, Neural Networks, data analysis, data visualization, AI, Artificial Intelligence, data storytelling, deep learning, data science project, Programming, Python, ai sciences, computer vision, computer vision tutorial, learn computer vision, what is computer vision, computer vision projects, computer vision python, computer vision course, technology, computer vision explained, computer vision basics, intro to computer vision",https://www.youtube.com/watch?v=puB-4LuRNys
Computer Vision: Crash Course Computer Science #35,CrashCourse,427725,10568,157,15-11-2017,669,11.15,"John Green, Hank Green, vlogbrothers, Crash Course, crashcourse, education, computing, computers, crash course computer science, compsci, computation, computer vision, fei-fei li, kernel, filter, viola-jones, face detection, convolutional neural networks, convolution, image processing, facial recognition, deep learning, biometrics, autonomous cars, snapchat filters, barcodes, prewitt operators",https://www.youtube.com/watch?v=-4E2-0sxVUM
Why Computer Vision Is a Hard Problem for AI,Quanta Magazine,148851,5904,94,24-10-2023,518,8.63,"science, quanta, quanta magazine, explainer, science explainer, science video, educational video, computer vision, artificial intellgence, computer science",https://www.youtube.com/watch?v=YOKPo-I6cgs
How Computer Vision Applications Work,AltexSoft,30473,893,27,17-02-2022,795,13.25,"Computer Vision, Convolutional Neural Network, CNN, Deep Learning, Machine Learning, Weights, Kernel, AI, Artificial Intelligence, Tesla self-driving, Autopilot, ATTOL",https://www.youtube.com/watch?v=oGvHtpJMO3M
Deep Learning for Computer Vision with Python and TensorFlow – Complete Course,freeCodeCamp.org,958276,26325,724,06-06-2023,134200,2236.67,,https://www.youtube.com/watch?v=IA3WxTTPXqQ
How Computer Vision Works,Google Cloud Tech,328125,6793,116,19-04-2018,428,7.13,"how computer vision works, google cloud vision, video intelligence apis, rest api, how cnns work, how rnns work, how does computer vision work?, how do CNNs work?, CNNs, RNNs, convolutional neural nets, vision API, cloud video intelligence API, cloud vision API, human vision, machine learning, ML, neural network, recurrent neural network, google developers, cloud developers, google cloud, GCP, google cloud platform, how do RNNs Work?, GDS: Yes;",https://www.youtube.com/watch?v=OcycT1Jwsns
Hough Transform | Boundary Detection,First Principles of Computer Vision,187695,3613,0,03-03-2021,1300,21.67,"Hough transform, extraneous data, outliers, incomplete data, image space, parameter space, Hough space, accumulator array, voting, line detection, circle detection, edge gradient, first principles, computer vision, computational imaging, computational photography, Shree Nayar, Columbia Vision Laboratory, CAVE Laboratory, Computer Science, Columbia Engineering, School of Engineering and Applied Sciences, Columbia University",https://www.youtube.com/watch?v=XRBc_xkZREg
What Is Computer Vision & Why Does It Matter?,NVIDIA,37875,586,0,21-03-2022,116,1.93,"NVIDIA, Artificial Intelligence, Image Classification, Computer Science, Computer Vision, Computer Vision Software, Computer Vision Technology, Data Science, GAN, Image Datasets, Image Processing, Image Synthesis, Image Tracking, Instance Segmentation, Machine Vision, Medical Imaging, Object Classification, Object Detection, Object Localization, Object Recognition, Perception, Semantic Segmentation, Software Developer, Vision AI, Visual Data",https://www.youtube.com/watch?v=OnTgbN3uXvw
"Master Text, Image & Audio Processing with Phi-4-multimodal-instruct",Maximum Code,175,5,5,03-03-2025,480,8,"C#, Neural Networks, AI Tutorial, Machine Learning, Deep Learning, Programming, Coding, Artificial Intelligence, Software Development, Neural Network in C#, Beginners Guide, Tech Tutorial, Computer Science, Learning Rate, Activation Function, Backpropagation, Large Language Models, Chat System, LM Studio, Ollama, Retrieval-Augmented Generation, RAG, Microsoft Semantic Kernel, autogen, autogen studio, MultiModel AI, AI with Vision, Phi4, phi-4",https://www.youtube.com/watch?v=rEV5VoGUwjA
कंप्यूटर विज़न : यह काम किस प्रकार करता है | Computer Vision  | Analytics India Guru,AIM TV,2133,77,5,20-04-2024,248,4.13,,https://www.youtube.com/watch?v=cI3HwlYfrUQ
Natural Language Processing in Artificial Intelligence in Hindi | NLP with Demo and Examples,Gate Smashers,861020,16418,525,16-05-2019,1038,17.3,"NLP, NLP in AI, AI in nta net, AI, artificial intelligence, AI with examples, nta net 2022, gate 2022, ai online, neural networks, ai course, ai full course, nlp with example, nlp training, nlp tutorial, natural language processing tutorial, natural language processing applications, natural language processing notes, Natural Language Processing, Natural Language Processing in Artificial Intelligence, Natural Language Processing in Artificial Intelligence in Hindi",https://www.youtube.com/watch?v=bPpwZxasJo0
What is NLP (Natural Language Processing)?,IBM Technology,317843,8255,193,11-08-2021,577,9.62,"NLP, Natural Language Processing, AI, IBM, IBM Cloud, IBM Watson, Natural Language Understanding, NLU",https://www.youtube.com/watch?v=fLvJ8VdHLA0
Natural Language Processing In 5 Minutes | What Is NLP And How Does It Work? | Simplilearn,Simplilearn,687439,11638,568,17-03-2021,329,5.48,"natural language processing, what is nlp, what is nlp and how does it work, nlp, natural language processing in artificial intelligence, natural language processing tutorial, natural language processing in 5 minutes, nlp tutorial, nlp in 5 minutes, nlp programming tutorial, nlp and deep learning, nlp and machine learning, nlp and its applications, natural language processing tutorial for beginners, simplilearn nlp, nlp explained, nlp tutorial for beginners, simplilearn",https://www.youtube.com/watch?v=CMrHM8a3hqw
Natural Language Processing with spaCy & Python - Course for Beginners,freeCodeCamp.org,790602,11027,367,27-09-2021,10952,182.53,,https://www.youtube.com/watch?v=dIUTsFT2MeQ
Complete NLP Natural Language Processing in One Shot (4 Hours) | Semester Exam | In Hindi,5 Minutes Engineering,25565,555,28,31-05-2024,14356,239.27,,https://www.youtube.com/watch?v=OL435ArVFwE
