Title,Uploader,Views,Likes,Comments,Upload Date,Duration (Seconds),Duration (Minutes),Tags,URL
HTML & CSS Full Course:  Beginners to Pro 2024 | 3 Mini Projects Included 🔥 Web Development Course,College Wallah,641531,13814,563,28-03-2024,19763,329.38,"html, css, tutorial, course, full course, html css, html css full course, html css tutorial, web development, web developer, software engineer, software engineering, coding tutorial, html css course, learn to code, html full course, css full course, advanced html, advanced css, advanced html tutorial, advanced css tutorial",https://www.youtube.com/watch?v=HBqWsrqK89U
"Full Stack Web Development for Beginners (Full Course on HTML, CSS, JavaScript, Node.js, MongoDB)",freeCodeCamp.org,2405860,57319,1100,01-11-2022,26951,449.18,,https://www.youtube.com/watch?v=nu_pCVPKzTk
Web Development Premium notes | All About | coding webmaster,Coding Webmaster ,220,2,0,03-03-2025,20,0.33,,https://www.youtube.com/watch?v=elNipzNX-kM
"Front-end web development is changing, quickly",Fireship,1518650,64510,1800,05-09-2024,223,3.72,"webdev, app development, lesson, tutorial",https://www.youtube.com/watch?v=TBIjgBVFjVI
What is Web Development ? Complete RoadMap from Basics to Advanced | 2023,Apna College,2290660,90272,3000,01-10-2023,885,14.75,"C++, C++ coding, C++ full course, C++ placement course, how to code, programming, college placement course, C++ language, java, java language, java full course, java placement, java code, java coding",https://www.youtube.com/watch?v=z0n1aQ3IxWI
Python API Development - Comprehensive Course for Beginners,freeCodeCamp.org,2382371,55836,2300,01-11-2021,68427,1140.45,,https://www.youtube.com/watch?v=0sOvCWFmrtA
What is an API ? Simply Explained,Apna College,2377833,81595,3400,25-05-2021,320,5.33,"C++, C++ coding, C++ full course, C++ placement course, how to code, programming, college placement course, C++ language",https://www.youtube.com/watch?v=XGa4onZP66Q
APIs Explained (in 4 Minutes),Exponent,1368388,38573,303,22-05-2023,237,3.95,yt:cc=on,https://www.youtube.com/watch?v=bxuYDT-BWaI
APIs for Beginners - How to use an API (Full Course / Tutorial),freeCodeCamp.org,3229017,44682,898,06-02-2023,11226,187.1,,https://www.youtube.com/watch?v=WXsD0ZgxjRw
What Is REST API? Examples And How To Use It: Crash Course System Design #3,ByteByteGo,984279,28234,333,24-08-2022,321,5.35,,https://www.youtube.com/watch?v=-mN3VyJuCjM
Difference Between REST API vs Web API vs SOAP API Explained,Learn with Whiteboard,316302,7536,116,12-05-2023,444,7.4,"rest api, api, web api, soap api, soap api vs rest api, rest api vs soap, rest api vs soap api difference, rest api vs soap api vs web api, web api vs rest api, web api vs soap api, difference between soap and rest api, difference between web api and rest api, difference between rest api and web api, rest api explained, web api explained, soap api example, soap vs rest, soap vs rest vs web api, soap vs web api, rest vs soap api, rest vs web api, rest vs soap vs web api",https://www.youtube.com/watch?v=2mqN7ZhDsUA
Good APIs Vs Bad APIs: 7 Tips for API Design,ByteByteGo,265537,9955,94,08-02-2024,348,5.8,,https://www.youtube.com/watch?v=_gQaygjm_hg
API vs. SDK: What's the difference?,IBM Technology,1517493,44200,713,16-10-2020,561,9.35,"API, SDK, Application Programming Interface, Software Development Toolkit, REST API, Node, Java, Python, Go, HTTP Methods, Visual Recognition, cloud computing, IBM, IBM Cloud, IBM API Connect, cloud service",https://www.youtube.com/watch?v=kG-fLp9BTRo
"Laravel 12 Complete Course | CRUD, Breeze Auth, REST APIs | Ultimate Beginner to Pro Guide! 💡",Online Web Tutor,822,38,2,03-03-2025,12805,213.42,"Laravel 12 full course, Laravel 12 tutorial, Laravel 12 CRUD, Laravel 12 authentication, Laravel 12 Breeze auth, Laravel 12 Sanctum, Laravel 12 Passport, Laravel 12 JWT, Laravel API authentication, Laravel 12 REST API, Laravel 12 email sending, Laravel Gmail SMTP, Laravel 12 API tutorial, Laravel 12 beginners guide, Laravel 12 CRUD with authentication, Laravel 12 full tutorial",https://www.youtube.com/watch?v=TllUuRhcWDI
What is an API and how do you design it? 🗒️✅,Gaurav Sen,764969,16272,417,17-03-2019,926,15.43,"system design, interview preparation, interviews, software interview, design interview, programming interview, gaurav sen, api design, application programmable interface, application programming interface, what is api, what is an api, api parameters, http api, api endpoint, http endpoint",https://www.youtube.com/watch?v=_YlYuNMTCc8
What Are Microservices Really All About? (And When Not To Use It),ByteByteGo,755539,20638,296,11-10-2022,285,4.75,,https://www.youtube.com/watch?v=lTAcCNbJ7KE
What are MicroServices? When & Why is it used? | Monolithic vs Microservices Architecture,Apna College,434967,12617,451,21-04-2024,554,9.23,"C++, C++ coding, C++ full course, C++ placement course, how to code, programming, college placement course, C++ language, java, java language, java full course, java placement, java code, java coding",https://www.youtube.com/watch?v=7IFJb-uLEaI
"Microservices explained - the What, Why and How?",TechWorld with Nana,932765,29551,577,16-08-2022,1110,18.5,"microservices, microservices architecture, microservices tutorial, what are microservices, microservices communication, monolith to microservices, monolith vs microservices, microservices monorepo, microservices polyrepo, monorepo vs polyrepo, techworld with nana, microservices design pattern, why microservices, microservices benefits, what is a monolith, how microservices connect with each other, how microservices work, communication between microservices",https://www.youtube.com/watch?v=rv4LlmLmVWk
Monolithic vs Microservice Architecture: Which To Use and When?,Alex Hyett,112467,3557,111,17-03-2023,642,10.7,"advantages of microservices, are monoliths bad, grpc, microservice architecture design, microservices, microservices architecture, microservices tutorial, microservices vs monolithic, microservices vs monolithic architecture, monolith microservices, monolith vs microservices, monolithic architecture, pros and cons of microservice architecture, pros and cons of microservices, service mesh, software architecture, software engineering, what are microservices, what are monoliths",https://www.youtube.com/watch?v=NdeTGlZ__Do
Microservices Architecture Online Training,Questpond,21722,439,28,07-10-2023,4040,67.33,"Microservices training, Microservices, .NET microservices, advanced microservices training, what is microservices, Microservices Architecture, Microservices Architecture patterns, Microservices Architecture training, Microservices online training, Microservices Training for beginners, Microservices step by step training, c# microservices architecture, microservices training online, CQRS, what is DDD, microservices with .NET core, .net microservices training for beginners",https://www.youtube.com/watch?v=Tu8_bMNRlM4
Microservice Architecture and System Design with Python & Kubernetes – Full Course,freeCodeCamp.org,492383,12232,363,08-11-2022,18251,304.18,,https://www.youtube.com/watch?v=hmkF77F9TLw
Microservices Design Patterns | Microservices Architecture Patterns | Edureka,edureka!,255219,3783,47,27-09-2019,1906,31.77,"yt:cc=on, microservices design patterns, microservices architecture patterns, design patterns for microservices, microservices patterns, what are microservices, microservices tutorial, top microservices design patterns, microservices software patterns, microservices designs, microservices example, microservices design principles, microservices design pattern principles, microservices design patterns for web applications, microservices patterns for java applications, edureka",https://www.youtube.com/watch?v=xuH81XGWeGQ
API GATEWAY and Microservices Architecture | How API Gateway act as a Single Entry Point?,Concept && Coding - by Shrayansh,69941,1709,97,29-09-2024,1397,23.28,"API GATEWAY, api gateway vs load balancer, microservice architecture, load balancer, api composition, rate limiting, service registery, service discovery, microservices, system design, high level design, software engineer stuff, backend engineer interviews, interview preparation SDE, system design interview, amazon interview question, API GATEWAY Architecture, Microservices Architecture, google system design interview, interview preparation, microsoft system design interview",https://www.youtube.com/watch?v=dkgxvnk8cWw
Enterprise AI Agents (Maximizing Business Value with Enterprise AI Agents and Distributed Systems),Go Cloud Architects,432,35,3,03-03-2025,989,16.48,"agentic ai hosting, enterprise ai, enterprise ai agents, ai enterprise architecture, multi-cloud ai architecture, ai digital transformation, distributed ai architecture, ai agent hosting, go cloud architects, go cloud careers",https://www.youtube.com/watch?v=CikoXC_FA28
What is a MICROSERVICE ARCHITECTURE and what are its advantages?,Gaurav Sen,735653,16941,442,20-05-2018,499,8.32,"Microservices, Microservice architecture, System design, System architecture, monolith, advantages of microservice, system design interview, scalability, microservice advantages, IT interview, software interview, microservices comparison, monolith architecture, gaurav sen, gkcs",https://www.youtube.com/watch?v=qYhRvH9tJKw
Types of Testing in Software Engineering | Levels of Testing,Gate Smashers,1094876,25586,496,31-12-2020,506,8.43,"testing types in software engineering in hindi, testing types in manual testing, testing types in software testing, testing types in software engineering, testing types javatpoint, software testing types in hindi, testing types guru99, testing types in devops, testing types and levels, testing types in sdlc, testing types and artifacts, testing types pdf, testing types ppt, testing in software, software testing, unit testing, integration testing, testing in hindi, se ugc net",https://www.youtube.com/watch?v=T0TynxN77oY
Software Testing Full Course In 10 Hours | Software Testing Tutorial | Edureka,edureka!,1810968,28927,537,11-03-2021,37110,618.5,"yt:cc=on, software testing tutorial, software testing full course, software testing training for beginners, automation testing tutorial for beginners, automation testing, manual testing tutorial for beginners, functional testing, regression testing, performance testing interview questions and answers, performance testing using jmeter, jmeter tutorial for beginners, edureka training, software testing, edureka, manual testing, selenium tutorial, software testing training",https://www.youtube.com/watch?v=sO8eGL6SFsA
Software Testing Tutorial For Beginners | Manual & Automation Testing | Selenium Training | Edureka,edureka!,1474988,19306,151,11-02-2019,3651,60.85,"yt:cc=on, software testing tutorial, software testing tutorial for beginners, software testing, manual testing, automation testing, types of testing, software testing life cycle, test case, software testing tools, what is software testing, software testing basics, waterfall model, spiral model, v&v model, locators in selenium, xpath, manual testing tutorial, selenium certification training, phases of testing, black box testing, white box testing, Selenium training, edureka",https://www.youtube.com/watch?v=T3q6QcCQZQg
What is Software Testing?,Telusko,308867,6005,195,17-07-2019,368,6.13,"telusko, navin, reddy, tutorial, java, python",https://www.youtube.com/watch?v=cDQ34z0oqnQ
"The HARSH Truth About Software Testing Jobs in 2025 🔥 SDET, QA Automation & Complete Roadmap!",Technical Suneja,66984,3839,274,25-01-2025,3615,60.25,"TechnicalSuneja, AjaySuneja, SoftwareTesting, AutomationTesting, ManualTesting, AutomationQA, TestingVsDevelopment, SDET, AutomationTester, SoftwareTestingCareers, TestingForBeginners, TesterSalary, TechCareers2025, FullStackQA, TCSJobs, FutureOfAutomationTesting, RoadmapToAutomation, TechSalaryInIndia, SoftwareTestingIn2025, TestingTools, TestAutomationRoadmap, QualityAssurance., testing, harsh, Truth, reality, jobs, Software Testing",https://www.youtube.com/watch?v=S23SvV3XGU4
Software Testing Explained in 100 Seconds,Fireship,376245,20031,315,24-05-2021,136,2.27,"webdev, app development, lesson, tutorial, software, tdd, bdd, software testing, tech, programming, coding, code, code testing",https://www.youtube.com/watch?v=u6QfIXgjwGQ
Test Plan in Software Testing | Software Testing | SoftwaretestingbyMKT,SoftwaretestingbyMKT,293056,8330,328,21-10-2019,1498,24.97,"test plan, test plan in software testing, sdet, qa, career, softwaretestingbymkt, test plan document, testing, software testing, test plan vs test strategy, test plan in easy way explained, release notes in software testing, objective in test plan, entry and exit criteria, defect tracking, test environment, testing methodologies, test plan template in software testing, Test Planning in Software Testing, Test Plan Template in Software Testing, Test Plan Sample, sdlc, stlc, agile, scrum",https://www.youtube.com/watch?v=NiDe8lj-wGs
Lecture 2: What is Software Testing? | Job Ready Software Testing Course,TheTestingAcademy Hindi,69167,1556,137,31-12-2022,697,11.62,"software testing course, software testing tutorial in hindi, software testing, software testing course for career gap, free software testing course, manual testing concepts, what is software testing?, software tester with skill, career in software testing, types of software, application software, system software, types of software in hindi, programming software, what is software testing, role of software tester, what are software testing objective and purpose, what is quality",https://www.youtube.com/watch?v=28hHc-K38ao
AI Solutions for Enterprise Testing Challenges,Automation Testing with Joe Colantonio,1326,29,1,02-03-2025,1970,32.83,"test automation, scalability, maintainability, modern applications, enterprise environments, Srirang, Tengen, AI-driven intelligence, software testing, integrated test management, AI-assisted test design, natural language, tracking and reporting, ML-driven execution optimization, parallel test execution, automate testing, enterprise testing, digital adopters, enterprise platforms, commercial off the shelf software, UI discovery, robotic discovery, screen navigation",https://www.youtube.com/watch?v=m8PWmO-4HAY
5 Types of Testing Software Every Developer Needs to Know!,Alex Hyett,108749,3954,66,03-03-2023,383,6.38,"types of testing, types of testing in software engineering, software testing, types of testing in software testing, unit testing, component testing, integration testing, end-to-end testing, end-to-end testing in software, types of software testing, cucumber tests, gherkin language, selenium, specflow, software testing tutorial, testing pyramid, software testing pyramid, code coverage, mcdc coverage, mcdc, 100% code coverage",https://www.youtube.com/watch?v=YaXJeUkBe4Y
What is DevOps? DevOps Explained | Simplest Explanation in Hindi,Apna College,1027338,32650,1100,06-04-2023,396,6.6,"C++, C++ coding, C++ full course, C++ placement course, how to code, programming, college placement course, C++ language, java, java language, java full course, java placement, java code, java coding",https://www.youtube.com/watch?v=h7LDnVsNRVI
DevOps Tutorial for Beginners | Learn DevOps in 7 Hours - Full Course | DevOps Training | Edureka,edureka!,3509099,45635,315,30-06-2019,24433,407.22,"yt:cc=on, devops, dev ops, devops full course, devops tutorial for beginners, devops tutorial, devops training, devops for beginners, devops tools tutorial, devops tools, learn devops, devops training videos, devops fundamentals, devops concepts, devops certification, what is devops, devops video tutorial, devops architecture, devops basics, devops introduction, devops course, edureka, devops edureka, edureka devops, why devops, introduction to devops",https://www.youtube.com/watch?v=hQcFE0RD0cQ
DevOps In 5 Minutes | What Is DevOps?| DevOps Explained | DevOps Tutorial For Beginners |Simplilearn,Simplilearn,1945163,42956,241,16-02-2021,301,5.02,"devops, devops basics, devops basics for beginners, devops basics tutorial, devops basics tutorial for beginners, devops explained, devops explained simply, devops explained with example, devops explanation, devops in 5 minutes, devops pipeline explained, devops tools, devops tools explained, devops training, devops tutorial, devops tutorial for beginners, learn devops, simplilearn, simplilearn devops, what is devops, why devops, why devops is important, why devops is needed",https://www.youtube.com/watch?v=Xrgk023l4lI
DevOps Engineering Course for Beginners,freeCodeCamp.org,1074693,24124,297,15-06-2021,8298,138.3,,https://www.youtube.com/watch?v=j5Zsa_eOXeY
Azure DevOps Step by Step Tutorial for Beginners | DevOps Tutorial,Questpond,360446,7055,501,12-03-2023,6127,102.12,"what is devops, Azure devops tutorial, devops tutorial for beginners, azure devops, learn devops from scratch, create ci cd pipeline azure devops, learn devops step by step, ci cd pipeline, devops for beginners, tutorial for devops engineers, yaml tutorial, devops step by step course, azure devops training videos, microsoft azure devops, understand azure devops, devops CI CD Pipeline, learn azure devops, azure devops for beginners, yaml devops tutorials, yaml",https://www.youtube.com/watch?v=aonA7Kb7WGE
What is DevOps? REALLY understand it | DevOps vs SRE,TechWorld with Nana,1006589,15728,466,18-01-2022,2132,35.53,"devops, what is devops, devops vs sre, sre vs devops, sre vs devops what's the differen, devops engineer, devops roadmap, techworld with nana, what devops engineer do, devops explained, what devops means, what devops, devops concepts, devops tutorial, devops tools, devops for beginners, devops explained for dummies, why devops, why devops is needed, why devops is important, how devops works, devops meaning, devops in practice, what devops is, devops tutorial for beginners",https://www.youtube.com/watch?v=0yWAtQ6wYNM
Linux For DevOps In One Shot | Complete Beginners to Advanced Linux (Hindi),TrainWithShubham,173759,4858,262,21-10-2024,20759,345.98,"shubham londhe, train with shubham, trainwithshubham, devops, devops tutorial, aws devops, Linux for DevOps, Linux beginners to advanced, Linux commands for DevOps, Linux tutorial in Hindi, DevOps Linux, Linux server setup, Linux basic commands, Linux networking commands, file management in Linux, LVM Linux tutorial, Linux for DevOps engineers, Linux advanced commands, Linux AWK GREP FIND SED, Linux volume management, complete Linux tutorial, TrainWithShubham",https://www.youtube.com/watch?v=e01GGTKmtpc
Day-1 | Fundamentals of DevOps | Free DevOps Course | 45 days | #devopscourse #learning,Abhishek.Veeramalla,1514541,23006,1600,05-01-2023,1839,30.65,"devops mock interview, devops discussion, DevOps RoadMap, aws, azure, k8s, tanzu, vmware, openshift, redhat, gcp, openstack, aws complete devops project, devops proxy interviews, #bts, BTS, bts, Ansible, Ansible FAQ, Ansible Q&A, Devops interview questions with answers, terraform, terraform interview questions, terraform Q&A, git, github, azure git, gitlab, azure devops interview questions, devops interview questions for experienced, DevOPs Roadmap, Free Python, Python course",https://www.youtube.com/watch?v=Ou9j73aWgyE
Jenkins In One Shot | DevOps Production CICD Pipelines [Hindi],TrainWithShubham,95243,2440,424,28-09-2024,23003,383.38,"shubham londhe, train with shubham, trainwithshubham, jenkins in one shot, Jenkins in one video, jenkins tutorial, jenkins for devops, jenkins zero to hero, Jenkins, Cicd with jenkins, cicd",https://www.youtube.com/watch?v=XaSdKR2fOU4
DevOps Tools - The Ultimate Guide! (2024),KodeKloud,122785,4344,405,04-01-2023,1025,17.08,"DevOps Tools, devops tools full course, devops tools explained, devops tools 2022, DevOps tools 2023, devops tools list, devops tools to learn, top devops tools, best devops tools, devops tools overview, devops, devops tools and architecture clear explanation, maven, chef, nagios, git, docker, jenkins, devops tools for ci/cd, best devops tools to learn, Docker, Kubernetes, Terraform, devops tools, Gradle, kodekloud",https://www.youtube.com/watch?v=4It0D0Nw00c
Computer Graphic Video Song | Poochudava Tamil Movie Song | Abbas | Simran | Sirpy | Music Master,Music Master | Tamil Songs | Ilayaraja,3207927,30277,1100,25-10-2016,288,4.8,"Computer Graphic Video Song, Poochudava Tamil Movie Song, Abbas, Simran, Sirpy, Music Master, poochudava, poochudava audio songs, poochudava full movie, poochudava movie, poochudava movie video song, poochudava songs, poochudava tamil movie, poochudava tamil video song, poochudava video songs, hits of sirpy, sirpi tamil song, sirpy hits, sirpy hits songs, sirpy songs, sirpy tamil song, sirpy video songs, Music, Tamil Video Song, Latest Tamil Songs, Tamil Hit Songs",https://www.youtube.com/watch?v=jFuhiuOFg28
Computer Graphics,Mano worldwide,183092,2415,20,25-01-2023,264,4.4,"Mano, Poochudava, Computer Graphics",https://www.youtube.com/watch?v=IRXH8V4uSak
DDA Line Drawing Algorithm - Computer Graphics,Abdul Bari,566420,13664,671,12-04-2018,1608,26.8,"DDA, Line Drawing, Line Drawing algorithm, dda algorithm, digital differential analyzer, digital differential analyser, computer graphics, abdul bari, bari",https://www.youtube.com/watch?v=W5P8GlaEOSI
How do Video Game Graphics Work?,Branch Education,4398291,282111,9500,21-12-2023,1260,21,"Video Game Graphics, GPU, Graphics Card, Ray Tracing, DLSS, NVIDIA, game development, Video Games, Graphics, Game Graphics, Sceen, Monitor, video games, 3D Graphics, RDR2, How do Video Game Graphics Work?, How do Graphics Work?, How do GPUs Work?, how do graphics cards work, Rendering Pipeline, Graphics Rendering Pipeline, Rasterization, Vertex Shading, Fragment Shading, game design, computer graphics, game devlog, GPUs, 3090Ti, 3090, Graphics Cards, 4090, 4080, CUDA Core, Shading Core",https://www.youtube.com/watch?v=C8YtdC8mxTU
Computer Graphics tutorial | Introduction | CG | Lec-01 | Bhanu Priya,Education 4u,666847,6129,124,28-05-2019,414,6.9,"computer graphics tutorial in english, computer graphics lecture, computer graphics education 4u, computer graphics introduction",https://www.youtube.com/watch?v=NmMky9Pg8Yc
Building Collision Simulations: An Introduction to Computer Graphics,Reducible,495867,18594,478,19-01-2021,1685,28.08,"Collision_Detection, Collision-Simulation",https://www.youtube.com/watch?v=eED4bSkYCB8
Introduction To Computer Graphics Explained in Hindi l Computer Graphics Course,5 Minutes Engineering,869548,14723,240,19-04-2021,544,9.07,,https://www.youtube.com/watch?v=uTBKa1PSyf8
Computer Graphic Song | Poochudava Tamil Movie Songs | Abbas | Simran | Sirpy | Music Master,Music Master | Tamil Songs | Ilayaraja,75809,755,22,16-08-2016,264,4.4,"Computer Graphic Song, Poochudava Tamil Movie Songs, Abbas, Simran, Sirpy, Music Master, Computer Graphic Video Song, Sirpy Songs, Sirpy Hits, Sirpy Tamil Songs, Sirpy Songs Collection, Sirpy Hit Songs, Sirpy Video Songs, Best of Sirpy, Sirpy Evergreen Songs, Sirpy Hit Video Songs, Sirpy Songs Jukebox, Sirpy Tamil Hits, Sirpy Melody, Sirpy Tamil Melody, Sirpy Poochudava Songs, Poochudava Songs, Poochudava Video Songs, Poochudava Songs Jukebox, Music, Tamil Video Songs",https://www.youtube.com/watch?v=EEoKttboeJA
The Evolution of Adobe and The Creative Software Industry,NY Editz,435,0,1,03-03-2025,28,0.47,,https://www.youtube.com/watch?v=JxdFr9Z040U
Quick Understanding of Homogeneous Coordinates for Computer Graphics,Miolith,82926,4544,135,03-12-2023,413,6.88,"Graphics Programming, Computer Graphics, Homogeneous Coordinates, 3D Object Representation, Linear Algebra in Graphics, Vulkan, OpenGL, Matrix Transformation, Perspective Projection, 4D Vectors, Coordinate Systems, Computer Graphics Libraries, Transformation Matrices, Performance Optimization, Debugging in Graphics, API Programming, Vector Manipulation, Perspective Rendering, Graphics Pipeline",https://www.youtube.com/watch?v=o-xwmTODTUI
The Ultimate Roadmap for Embedded Systems | How to become an Embedded Engineer in 2025,Sanchit Kulkarni,77030,4060,177,04-01-2025,1009,16.82,"ChipCamp, Sanchit Kulkarni, chip camp, electronics, semiconductor, embedded, ece, btech, chip_camp, embedded system, electronics camp, digital, engineering, entc, nvidia, How to become an embedded engineer, Roadmap for embedded systems, c programming for embedded systems course, what is bootloader in embedded system, device driver programming in embedded systems, introduction to embedded c programming, embedded systems projects for final year, microcontroller and embedded systems, rtos",https://www.youtube.com/watch?v=D7L1SmjQ3fo
"Microcontrollers, Embedded Systems, and STM32.",thehardwareguy,18474,659,44,22-05-2021,752,12.53,"thehardwareguy, stm32, stm32f4 discovery, stmicroelectronics, stm32 project, microcontrollers, microcontrollers explained, microcontrollers for beginners, stm32f401 nucleo 64, stm32f407 discovery, microcontrollers and embedded systems, arm microcontroller, stm32 vs arduino, arduino vs stm32, embedded systems, stm32 for beginners, what are microcontrollers, what are embedded systems, microcontroller projects, microcontroller programming, electronic engineering, hardware engineer",https://www.youtube.com/watch?v=DOyuEyo_qeg
Top 5 Embedded Systems Courses with Certification | Best courses for Embedded @electronicsgeek,electronics geek,92645,2796,54,16-07-2023,189,3.15,"Best youtube channel to learn electronics, top youtube channel to learn electronics proejcts, Top 5 Embedded Systems Courses with Certification, Top 5 Embedded Systems Courses, Top 5, Best courses, best courses for embedded systems, best courses for embedded, Embedded Systems Courses with Certification, Top 5 Embedded Systems Course, Embedded Systems Course, electronics geek, free course with certificate, top 5 best embedded systems courses online",https://www.youtube.com/watch?v=xCwcjKGZhlA
